note_id,country_name,latitude,longitude,opened_at,closed_at,days_to_resolution,opened_by_username,opening_comment,total_comments,was_reopened,closed_by_username,closing_comment
CREATE FUNCTION
5053603,Liechtenstein,47.2488838,9.5271247,2025-11-15 00:00:00,2025-11-26 16:08:05,0,sonnatager,"'Moved to another place' The place has gone or never existed. A user of Organic Maps application has reported that the POI was visible on the map (see snapshot date below), but was not found on the ground. OSM snapshot date: 2025-10-21T03:35:21Z POI name: PHIOS AG POI types: office-company  #organicmaps android 2025.10.27-1-Google",2,0,Mister Kanister,solved with https://www.openstreetmap.org/changeset/175161397
5037824,Liechtenstein,47.2485020,9.5281000,2025-11-04 00:00:00,2025-11-11 17:49:19,0,Unknown,Barex Inkasso AG Industriering 14 9491 Ruggell,2,0,mcliquid,behoben
4697422,Liechtenstein,47.1433892,9.5206707,2025-04-05 00:00:00,2025-10-19 11:43:12,0,_R0by_,Unable to answer 'Is there a shelter at this stop?' – Vaduz Mitteldorf (Bus Stop) – https://osm.org/node/8422493395 via StreetComplete 60.3:  Does not exist here. Was added on real position,4,0,idk what to do bc im bored,"Nope, Vaduz Mitteldorf doesn't have an shelter according to the Liechtenstein Civil Protection Authority and the municipality of Vaduz and the location is correct after i saw it on Google Maps to confirm it."
4693427,Liechtenstein,47.1558815,9.5048580,2025-04-02 00:00:00,2025-10-14 07:27:49,0,Faberitex,In context of overlay 'Things' – Vaduz Schulzentrum (Bus Platform) – https://osm.org/way/907570221 via StreetComplete 60.3:  Scheint nicht zu existieren,3,0,japalie91,
4993028,Liechtenstein,47.2118373,9.5232918,2025-10-06 00:00:00,2025-10-06 12:09:55,0,nethad,"'habe die Bäckerei am korrekten Gebäude hinterlegt, St. Luzia-Strasse 21' The place has gone or never existed. A CoMaps user reported that the POI was visible on the map (see snapshot date below), but was not found on the ground. OSM snapshot date: 2025-08-22T03:20:49Z POI name: Mündle POI types: wheelchair-yes shop-bakery  #CoMaps android",2,0,map per,"Danke, hab den falschen Eintrag entfernt"
4958084,Liechtenstein,47.0999900,9.5478900,2025-09-12 00:00:00,2025-09-17 18:23:13,0,b_mortgat,Bad rendering on CyclOSM featured tile layer due to a waterway as outer forest way (probably incorrect information given the elevation data),2,0,Badojo,"Removed the stream tag from outer way of the forest, should be fixed now"
4930559,Liechtenstein,47.1375050,9.5200660,2025-08-26 00:00:00,2025-09-01 17:08:31,0,Unknown,Hier ist die Adresse doppelt eingetragen,2,0,mcliquid,Fixed
4931076,Liechtenstein,47.1194291,9.6098306,2025-08-26 00:00:00,2025-09-01 17:08:17,0,FrauMais,'Heisst eigentlich „Sassförkle“' OSM snapshot date: 2025-08-08T13:08:07Z POI name: Sassfürkle POI types: place-locality natural-saddle  #organicmaps ios,2,0,mcliquid,Fixed
4697420,Liechtenstein,47.1462760,9.5225576,2025-04-05 00:00:00,2025-06-16 00:37:29,0,_R0by_,Unable to answer 'Is the water potable here?' – Water Well – https://osm.org/node/12731398084 via StreetComplete 60.3:  Images of the fountain  Attached photo(s): https://streetcomplete.app/p/269546.jpg https://streetcomplete.app/p/269547.jpg,8,1,The_Nickname,"Perfekt, danke!"
4697419,Liechtenstein,47.1412791,9.5258574,2025-04-05 00:00:00,2025-06-13 19:23:44,0,_R0by_,In context of overlay 'Things' – Memorial – https://osm.org/node/12731398083 via StreetComplete 60.3:  Photo  Attached photo(s): https://streetcomplete.app/p/269545.jpg,4,0,The_Nickname,"Ok, danke dir! Thank you!"
4738279,Liechtenstein,47.1006771,9.6104428,2025-05-02 00:00:00,2025-06-10 15:51:16,0,Missega_18,'Gratuites' OSM snapshot date: 2025-02-13T05:46:10Z POI has no name POI types: amenity-toilets  #organicmaps ios,3,0,Missega_18,Ja. Es ist frei. Danke!
4794518,Liechtenstein,47.1726272,9.5193812,2025-06-07 00:00:00,2025-06-09 15:51:48,0,The_Nickname,Bei diesen Häusern gibt es je noch etwa einen Weg leicht runter und drum rum.  via StreetComplete 61.1  Attached photo(s): https://streetcomplete.app/p/282882.jpg,2,0,The_Nickname,"Eingetragen und einige weitere details welche vom Luftbild aus sichtbar waren, mit https://www.openstreetmap.org/changeset/167406040"
4794519,Liechtenstein,47.1737856,9.5201247,2025-06-07 00:00:00,2025-06-09 15:33:39,0,The_Nickname,Hier ist eine Grundstückszufahrt  via StreetComplete 61.1  Attached photo(s): https://streetcomplete.app/p/282883.jpg,2,0,The_Nickname,Eingetragen mit: https://www.openstreetmap.org/changeset/167405128
4794521,Liechtenstein,47.1807659,9.5224779,2025-06-07 00:00:00,2025-06-09 15:30:26,0,The_Nickname,Zugang  via StreetComplete 61.1  Attached photo(s): https://streetcomplete.app/p/282884.jpg,2,0,The_Nickname,Eingetragen mit https://www.openstreetmap.org/changeset/167404932
4794520,Liechtenstein,47.1810583,9.5226986,2025-06-07 00:00:00,2025-06-09 15:30:19,0,The_Nickname,Einfahrt  via StreetComplete 61.1,2,0,The_Nickname,Ungefähr eingetragen https://www.openstreetmap.org/changeset/167404932
4795487,Liechtenstein,47.2002834,9.5256802,2025-06-08 00:00:00,2025-06-09 15:22:54,0,The_Nickname,Unable to answer 'How is this power line attached?' – Power Pole – https://osm.org/node/4180939902 via StreetComplete 61.1:  Irgendwie doppelt?  Attached photo(s): https://streetcomplete.app/p/282989.jpg https://streetcomplete.app/p/282990.jpg,2,0,The_Nickname,"Wohl veraltet, geschlossen durch: https://www.openstreetmap.org/changeset/167404533"
4795491,Liechtenstein,47.2331260,9.5475814,2025-06-08 00:00:00,2025-06-09 15:04:27,0,The_Nickname,Zwischen untem und Pfadfinderhausgrundstück ist wahrscheinlich ein Weg mit Treppe  via StreetComplete 61.1,2,0,The_Nickname,Macht vom Luftbild auch den Eindruck: https://www.openstreetmap.org/changeset/167403545
4795492,Liechtenstein,47.2417063,9.5609939,2025-06-08 00:00:00,2025-06-09 14:52:24,0,The_Nickname,"In context of overlay 'Sidewalks' – Track / Land-Access Road – https://osm.org/way/169286616 via StreetComplete 61.1:  Fußweg, schmal, mit Geländer und Laternen.",2,0,The_Nickname,https://www.openstreetmap.org/changeset/167402779
4795490,Liechtenstein,47.2224208,9.5413309,2025-06-08 00:00:00,2025-06-09 11:15:02,0,The_Nickname,Hier neben ist ein Bächlein/Kanal  via StreetComplete 61.1  Attached photo(s): https://streetcomplete.app/p/282992.jpg https://streetcomplete.app/p/282993.jpg https://streetcomplete.app/p/282994.jpg,4,1,The_Nickname,"Bin mir nicht 100%ig sicher, ob dass die richtige art von Ditch/Drain ist, der Kanal hat ja viele Stufen und ist sehr sehr schmal, aber sollte so grob stimmen."
4795489,Liechtenstein,47.2109117,9.5278883,2025-06-08 00:00:00,2025-06-09 10:24:42,0,The_Nickname,"Umleitung, normalerweise halb Weg, halb Hof/Zufahrtsweg  via StreetComplete 61.1  Attached photo(s): https://streetcomplete.app/p/282991.jpg  GPS Trace: https://www.openstreetmap.org/user/The_Nickname/traces/11997016",2,0,The_Nickname,https://www.openstreetmap.org/changeset/167389159
4697421,Liechtenstein,47.1451885,9.5218145,2025-04-05 00:00:00,2025-05-06 07:20:14,0,_R0by_,New path  via StreetComplete 60.3  GPS Trace: https://www.openstreetmap.org/user/_R0by_/traces/11950062,2,0,ProfStoneface,Neuen Pfad nun erstellt.
4693425,Liechtenstein,47.1574891,9.5064534,2025-04-02 00:00:00,2025-05-06 07:09:30,0,Faberitex,Diese Häuser sind alle gar nicht unterirdisch.  via StreetComplete 60.3,2,0,ProfStoneface,"Ich habe die ebene nun angepasst. Tunnel für Entwässerungsgraben erstellt, Häuser auf Ebene 0."
4697418,Liechtenstein,47.1406252,9.5226202,2025-04-05 00:00:00,2025-05-05 04:00:19,0,_R0by_,In context of overlay 'Things' – Drinking Water – https://osm.org/node/1364169778 via StreetComplete 60.3:  Is a fountain  Attached photo(s): https://streetcomplete.app/p/269544.jpg,2,0,vmicho,fixed + added shape ;) https://www.openstreetmap.org/changeset/165826038
4693422,Liechtenstein,47.1647531,9.5083740,2025-04-02 00:00:00,2025-05-04 20:13:40,0,Faberitex,"Das Gebäude ist falsch gemappt, hier ist eine Art Platz, das Gebäude ist viel kleiner.  via StreetComplete 60.3",3,0,vmicho,Looks already mapped correctly. I was on place and looks good.
4472065,Liechtenstein,47.1689055,9.5039457,2024-10-09 00:00:00,2025-05-04 20:08:58,0,Unknown,Ist das Brauhaus hier tatsächlich noch? Einem Liechtensteiner zufolge sei vor rd. 2 Jahren ein Umzug nach https://www.openstreetmap.org/node/9992406417 erfolgt. Ggf.vor Ort zu prüfen...,3,0,vmicho,"yes, there is nothing here now. Brauhaus is only at the new address. Fixed  https://www.openstreetmap.org/changeset/165817588"
4693423,Liechtenstein,47.1644569,9.5088052,2025-04-02 00:00:00,2025-05-04 20:05:22,0,Faberitex,Diese Bushaltestelle scheint nicht zu existieren. Bitte nochmal abgleichen.  via StreetComplete 60.3,3,0,vmicho,fixed https://www.openstreetmap.org/changeset/165817197
4695763,Liechtenstein,47.1977903,9.5424843,2025-04-04 00:00:00,2025-05-04 02:37:38,0,Ostenaaa,Somebody has tagged a Residental area as a industrial building,2,0,vmicho,this was fixed as mistake https://www.openstreetmap.org/changeset/164890371
4734581,Liechtenstein,47.2066322,9.5326245,2025-04-30 00:00:00,2025-05-01 15:24:12,0,Unknown,test,2,0,mavl,This note does not contain a useful information for OpenStreetMap.
4685021,Liechtenstein,47.1110077,9.5519149,2025-03-27 00:00:00,2025-04-07 21:44:32,0,Unknown,Way 329685142 self-intersects itself in a weird way,2,0,nleanba,I have straightened it: https://www.openstreetmap.org/changeset/164654017
4693421,Liechtenstein,47.1664911,9.5093078,2025-04-02 00:00:00,2025-04-04 20:58:23,0,Faberitex,"Dort, wo die Bäume eingezeichnet sind, ist auch jeweils eine Bank.  via StreetComplete 60.3",2,0,Faberitex,Eingefügt
4693424,Liechtenstein,47.1599494,9.5083510,2025-04-02 00:00:00,2025-04-04 20:43:04,0,Faberitex,Hier ist ein Weg.  via StreetComplete 60.3  Attached photo(s): https://streetcomplete.app/p/268992.jpg,3,1,Faberitex,"Das scheint Teil größerer Umbauten zu sein, da haben sich evtl. auch die Häuser, wo der Weg hinführt (Süden) geändert. Am besten nochmal vor Ort schauen oder auf aktualisiertes Luftbild warten."
4693418,Liechtenstein,47.1485798,9.5165700,2025-04-02 00:00:00,2025-04-04 20:38:40,0,Faberitex,Das ist eine Treppe  via StreetComplete 60.3  Attached photo(s): https://streetcomplete.app/p/268990.jpg,2,0,Faberitex,Hinzugefügt
4693420,Liechtenstein,47.1486407,9.5168578,2025-04-02 00:00:00,2025-04-04 20:37:05,0,Faberitex,Hier ist eine Treppe  via StreetComplete 60.3  Attached photo(s): https://streetcomplete.app/p/268991.jpg,2,0,Faberitex,Hinzugefügt
4693419,Liechtenstein,47.1493805,9.5170004,2025-04-02 00:00:00,2025-04-04 20:35:02,0,Faberitex,Hier ist auch eine Treppe  via StreetComplete 60.3,2,0,Faberitex,HInzugefügt
4693417,Liechtenstein,47.1503135,9.5164165,2025-04-02 00:00:00,2025-04-04 20:33:10,0,Faberitex,Das ist eine Treppe  via StreetComplete 60.3  Attached photo(s): https://streetcomplete.app/p/268989.jpg,2,0,Faberitex,Eingefügt
4693415,Liechtenstein,47.1510033,9.5208967,2025-04-02 00:00:00,2025-04-04 20:25:29,0,Faberitex,Dieser Weg existiert nicht.  via StreetComplete 60.3  Attached photo(s): https://streetcomplete.app/p/268987.jpg,2,0,Faberitex,Entfernt
4693416,Liechtenstein,47.1506909,9.5202412,2025-04-02 00:00:00,2025-04-04 20:24:39,0,Faberitex,Hier ist ein Weg.  via StreetComplete 60.3  Attached photo(s): https://streetcomplete.app/p/268988.jpg  GPS Trace: https://www.openstreetmap.org/user/Faberitex/traces/11948421,2,0,Faberitex,Hinzugefügt
4693414,Liechtenstein,47.1516205,9.5205005,2025-04-02 00:00:00,2025-04-04 20:22:50,0,Faberitex,Dieser Weg existiert nicht.  via StreetComplete 60.3  Attached photo(s): https://streetcomplete.app/p/268986.jpg,2,0,Faberitex,Entfernt
4693412,Liechtenstein,47.1520858,9.5299056,2025-04-02 00:00:00,2025-04-04 20:22:32,0,Faberitex,Hier fehlt ein Weg (Beschaffenheit wie der Wanderweg)  via StreetComplete 60.3,2,0,Faberitex,Hinzugefügt
4693413,Liechtenstein,47.1526099,9.5223863,2025-04-02 00:00:00,2025-04-04 20:17:32,0,Faberitex,Hier fehlt ein Weg.  via StreetComplete 60.3  Attached photo(s): https://streetcomplete.app/p/268985.jpg  GPS Trace: https://www.openstreetmap.org/user/Faberitex/traces/11948420,2,0,Faberitex,Hinzugefügt
4693411,Liechtenstein,47.1363853,9.5146943,2025-04-02 00:00:00,2025-04-04 20:08:52,0,Faberitex,Die beiden Häuser sind zusammenhängend  via StreetComplete 60.3,2,0,Faberitex,Zusammengefügt
4693426,Liechtenstein,47.1265702,9.5224864,2025-04-02 00:00:00,2025-04-04 20:05:50,0,Faberitex,"Die Straßen sind verbunden, die Durchfahrt für Autos ist jedoch durch Poller gesperrt  via StreetComplete 60.3",2,0,Faberitex,Straßen verbunden und Poller hinzugefügt
4693430,Liechtenstein,47.0794720,9.5126164,2025-04-02 00:00:00,2025-04-04 20:02:54,0,Faberitex,Hier ist eine Wertstoffsammelstelle  via StreetComplete 60.3  Attached photo(s): https://streetcomplete.app/p/268993.jpg,2,0,Faberitex,Hinzugefügt
4693431,Liechtenstein,47.0739686,9.5104898,2025-04-02 00:00:00,2025-04-04 19:46:42,0,Faberitex,Hier ist keine Durchfahrt für Autos  via StreetComplete 60.3  Attached photo(s): https://streetcomplete.app/p/268994.jpg,2,0,Faberitex,Poller hinzugefügt
4677909,Liechtenstein,47.2447940,9.5235550,2025-03-23 00:00:00,2025-03-26 10:37:01,0,Drazhar,fäkalienbeutel mit Mülleimer,2,0,habi,Resolved with changeset https://www.openstreetmap.org/changeset/164115211 by noteSolver_plugin/0.5.0
4642662,Liechtenstein,47.1170752,9.5235854,2025-02-26 00:00:00,2025-03-13 18:33:07,0,wohlsein,"Die Firma 'Silhouette, Wellness für Körper und Seele' gibt es hier nicht.",2,0,mcliquid,https://www.openstreetmap.org/changeset/163583187
4641146,Liechtenstein,47.1668170,9.5092110,2025-02-25 00:00:00,2025-03-12 16:18:24,0,Fürstentum Liechtenstein,California Concept ist umgezogen und neu an der Poststrasse 14,2,0,vmicho,moved ;)
4655851,Liechtenstein,47.2179150,9.5447340,2025-03-08 00:00:00,2025-03-08 20:39:19,0,Drazhar,Hundekottütenspender ohne Mülleimer. Kostenlos,2,0,Drazhar,
4655752,Liechtenstein,47.2187680,9.5056920,2025-03-08 00:00:00,2025-03-08 20:38:17,0,Drazhar,Hundekotbeutel mit Mülleimer,2,0,Drazhar,
4655709,Liechtenstein,47.2177250,9.5040040,2025-03-08 00:00:00,2025-03-08 20:34:59,0,Drazhar,Hundekotmülleimer mit Beutel,2,0,Drazhar,
4618501,Liechtenstein,47.1691351,9.4997102,2025-02-07 00:00:00,2025-02-07 20:53:39,0,ulrich_,Ist das Casino noch in Betrieb? https://www.lie-zeit.li/2022/11/schliessung-des-casino-maximus-in-schaan/,2,0,mcliquid,https://www.openstreetmap.org/changeset/162260625
4618505,Liechtenstein,47.2501188,9.5271930,2025-02-07 00:00:00,2025-02-07 20:52:09,0,ulrich_,Befindet sich hier das 'Casino Admiral'?,2,0,mcliquid,https://www.openstreetmap.org/changeset/162260599
4614799,Liechtenstein,47.1393003,9.5177516,2025-02-05 00:00:00,2025-02-05 14:40:13,0,DL RL,Your are here.,8,1,DL RL,delete
4602578,Liechtenstein,47.1450187,9.5222315,2025-01-26 00:00:00,2025-01-27 11:43:05,0,woy_cb,In context of overlay 'Surfaces' – Unmarked Crossing – https://osm.org/way/1324041165 via StreetComplete 60.1:  No trail  Attached photo(s): https://streetcomplete.app/p/258539.jpg,2,0,mcliquid,https://www.openstreetmap.org/changeset/161814871
4597749,Liechtenstein,47.1393003,9.5177436,2025-01-22 00:00:00,2025-01-22 14:05:39,0,DL RL,Am Schrägen Weg,2,0,DL RL,
4575628,Liechtenstein,47.1772927,9.5090907,2025-01-04 00:00:00,2025-01-04 23:12:26,0,Ekeefoof,Neubau  via StreetComplete_ee 60.0,2,0,mcliquid,Resolved with changeset https://www.openstreetmap.org/changeset/161004917 by noteSolver_plugin/0.5.0
4575353,Liechtenstein,47.1376857,9.5202631,2025-01-04 00:00:00,2025-01-04 23:11:38,0,Ekeefoof,Fußweg  via StreetComplete_ee 60.0  GPS Trace: https://www.openstreetmap.org/user/Ekeefoof/traces/11714444,2,0,mcliquid,Resolved with changeset https://www.openstreetmap.org/changeset/161004899 by noteSolver_plugin/0.5.0
4575352,Liechtenstein,47.1378045,9.5205546,2025-01-04 00:00:00,2025-01-04 23:11:00,0,Ekeefoof,Neubau  via StreetComplete_ee 60.0  Attached photo(s): https://streetcomplete.app/p/256229.jpg,2,0,mcliquid,Resolved with changeset https://www.openstreetmap.org/changeset/161004877 by noteSolver_plugin/0.5.0
4575453,Liechtenstein,47.1415005,9.5213463,2025-01-04 00:00:00,2025-01-04 23:10:16,0,Ekeefoof,Baustelle  via StreetComplete_ee 60.0,2,0,mcliquid,Erledigt
4473300,Liechtenstein,47.1496559,9.5121887,2024-10-10 00:00:00,2025-01-04 23:09:46,0,svencb,Ist das Restaurant hier tatsächlich noch? Die Website https://www.falknis.li/ gibt eine andere Adresse an.,3,0,mcliquid,Resolved with changeset https://www.openstreetmap.org/changeset/161004855 by noteSolver_plugin/0.5.0
4575320,Liechtenstein,47.1505539,9.5061381,2025-01-04 00:00:00,2025-01-04 23:09:27,0,Ekeefoof,Neubau  via StreetComplete_ee 60.0  Attached photo(s): https://streetcomplete.app/p/256222.jpg,2,0,mcliquid,Resolved with changeset https://www.openstreetmap.org/changeset/161004845 by noteSolver_plugin/0.5.0
4575535,Liechtenstein,47.1498674,9.5115042,2025-01-04 00:00:00,2025-01-04 23:09:26,0,Ekeefoof,Neubauten  via StreetComplete_ee 60.0  Attached photo(s): https://streetcomplete.app/p/256251.jpg,2,0,mcliquid,Resolved with changeset https://www.openstreetmap.org/changeset/161004845 by noteSolver_plugin/0.5.0
4575536,Liechtenstein,47.1512649,9.5083437,2025-01-04 00:00:00,2025-01-04 23:08:22,0,Ekeefoof,Neubau  via StreetComplete_ee 60.0  Attached photo(s): https://streetcomplete.app/p/256252.jpg,2,0,mcliquid,Resolved with changeset https://www.openstreetmap.org/changeset/161004821 by noteSolver_plugin/0.5.0
4522735,Liechtenstein,47.2184642,9.5076102,2024-11-17 00:00:00,2024-11-17 12:59:30,0,Granjow,new building here  #OsmAnd,2,0,mcliquid,https://www.openstreetmap.org/changeset/159241764
4520748,Liechtenstein,47.1713669,9.5098472,2024-11-15 00:00:00,2024-11-16 17:58:29,0,GauchoFL,Dieses Gebäude wurde abgerissen.,2,0,mcliquid,Resolved with changeset https://www.openstreetmap.org/changeset/159217893 by noteSolver_plugin/0.5.0
4520746,Liechtenstein,47.1715137,9.5100510,2024-11-15 00:00:00,2024-11-15 11:13:49,0,GauchoFL,Dieses Gebäude wurde inzwischen abgerissen.,2,0,GauchoFL,
4497219,Liechtenstein,47.1087194,9.5254926,2024-10-28 00:00:00,2024-11-13 19:39:06,0,Unknown,"onosm.org submitted note from a business: Name: Apotheke am SonnenPlatz addr:housenumber=251 addr:street=Landstrasse addr:city=Triesen addr:postcode=9495 Telefonnummer: +423 234 01 01 Webseite: www.apotheke-am-sonnenplatz.li Soziales Netzwerk: https://www.facebook.com/apothekeamsonnenplatz Öffnungszeiten: Mo-Fr: 8.00-19.00 / Sa: 8.00-16.00 / Sonn- und Feiertage 8.00-12.00 Rollstuhlzugang: yes Kategorie: Apotheke Akzeptierte Zahlungsmethoden: Bargeld,Bankkarte,American Express,Mastercard,Visa,Handy delivery=yes",2,0,mcliquid,Resolved with changeset https://www.openstreetmap.org/changeset/159104922 by noteSolver_plugin/0.5.0
4497217,Liechtenstein,47.2123050,9.5235822,2024-10-28 00:00:00,2024-11-13 19:37:46,0,Unknown,"onosm.org submitted note from a business: Name: Apotheke am St. Martins-Ring addr:housenumber=1 addr:street=Sankt Martins-Ring addr:city=Eschen addr:postcode=9492 Telefonnummer: +423 373 01 01 Webseite: www.apotheke-am-stmartinsring.li Soziales Netzwerk: https://www.facebook.com/apothekestmartinsring Öffnungszeiten: Mo-Fr: 8.00-12.15 und 13.15-18.30 / Sa: 8.00-16.00 Rollstuhlzugang: yes Kategorie: Apotheke Akzeptierte Zahlungsmethoden: Bargeld,Bankkarte,American Express,Mastercard,Visa,Handy delivery=yes delivery:description=Lieferung in der Region",2,0,mcliquid,Resolved with changeset https://www.openstreetmap.org/changeset/159104887 by noteSolver_plugin/0.5.0
4492697,Liechtenstein,47.1813362,9.5209864,2024-10-24 00:00:00,2024-10-25 14:02:34,0,0xb7767000,"https://www.openstreetmap.org/way/296962672  Ist das absicht, dass der Bahnsteig hier ein V bildet, oder kann man das auch auf eine Linie reduzieren?",2,0,mcliquid,https://www.openstreetmap.org/changeset/158339398
4491268,Liechtenstein,47.2121570,9.5137950,2024-10-23 00:00:00,2024-10-24 07:17:36,0,Unknown,Hausnummer 39 fehlt. Eichenstrasse 39,2,0,mcliquid,Erledigt
4490813,Liechtenstein,47.1301916,9.5151620,2024-10-23 00:00:00,2024-10-23 07:21:06,0,Unknown,#,3,0,pitscheplatsch,no useful information for editing OSM data
4466013,Liechtenstein,47.1402175,9.5215237,2024-10-05 00:00:00,2024-10-06 06:58:41,0,knowname,Mülleimer,2,0,mcliquid,https://www.openstreetmap.org/changeset/157526067
4451800,Liechtenstein,47.1380979,9.5166171,2024-09-25 00:00:00,2024-09-28 06:45:52,0,Gropisko,"Die Firma NOX Systems AG ist 2022 umgezogen. Neue Adresse: Kanalstrasse 18, 9490 Vaduz.",2,0,mcliquid,Resolved with changeset https://www.openstreetmap.org/changeset/157196466 by noteSolver_plugin/0.5.0
3682797,Liechtenstein,47.1522407,9.5334131,2023-05-10 00:00:00,2024-09-14 12:20:31,0,Matyjace,"Forwarding anonymous report from #Mapy.cz user, please verify: 'not a drinking water'",2,0,ivrigthighjob,ok
4392621,Liechtenstein,47.1655074,9.5091110,2024-08-19 00:00:00,2024-08-20 06:41:25,0,Mario Frick,"'Geschäft wurde aufgelöst ' The place has gone or never existed. A user of Organic Maps application has reported that the POI was visible on the map (see snapshot date below), but was not found on the ground. OSM snapshot date: 2024-08-10T16:22:45Z POI name: Hannelore POI types: shop-clothes  #organicmaps ios",2,0,mcliquid,https://www.openstreetmap.org/changeset/155492183
4374284,Liechtenstein,47.1450226,9.5250954,2024-08-09 00:00:00,2024-08-09 15:26:39,0,ckae,Hydrant mit folgender Nummer (siehe Bild)  via StreetComplete 58.2  Attached photo(s): https://westnordost.de/p/231012.jpg,2,0,mcliquid,https://www.openstreetmap.org/changeset/155028816
4366971,Liechtenstein,47.1418110,9.5447924,2024-08-04 00:00:00,2024-08-05 08:32:30,0,PandaTho,"'Alter Eintrag. Ein öffentliches WC befindet sich im angernzenden Clinicum. ' The place has gone or never existed. A user of Organic Maps application has reported that the POI was visible on the map (see snapshot date below), but was not found on the ground. OSM snapshot date: 2024-07-23T19:32:09Z POI has no name POI types: building fee-no amenity-toilets  #organicmaps android",2,0,mcliquid,https://www.openstreetmap.org/changeset/154838404
3212497,Liechtenstein,47.2412059,9.5248890,2022-06-06 00:00:00,2024-07-23 08:41:20,0,Mister Kanister,LIEmobil-Routen auf neue Streckenführung am Ruggeller Rathaus anpassen (Bauarbeiten noch nicht vollständig abgeschlossen),2,0,Mister Kanister,
2981552,Liechtenstein,47.0664241,9.5024443,2021-12-24 00:00:00,2024-06-26 09:13:13,0,Mister Kanister,"diverse Bushaltestellen des neuen Balzner Ortsbusses fehlen noch, teilweise auch die Haltestellen der anderen Fahrtrichtung.",3,0,Mister Kanister,"Es sieht so aus, als sei der Ortsbus seit Mai 2023 vollständig gemappt: https://www.openstreetmap.org/relation/15892997/history"
4307058,Liechtenstein,47.1505500,9.5210900,2024-06-25 00:00:00,2024-06-25 12:09:11,0,Unknown,"Closed for construction at the moment, see https://www.vaduz.li/news/rueckbau-der-altlasten-beim-familienpark-waldhotel (although the timeline there isn't accurate anymore...)",2,0,mcliquid,https://www.openstreetmap.org/changeset/153154341
4307008,Liechtenstein,47.1514500,9.5201400,2024-06-25 00:00:00,2024-06-25 12:07:18,0,Unknown,New parking spots at this place,2,0,mcliquid,https://www.openstreetmap.org/changeset/153154243
4289090,Liechtenstein,47.1401158,9.5226139,2024-06-12 00:00:00,2024-06-17 10:54:55,0,PiaVespRoll,Galerie am Lindenplatz  via StreetComplete_ee 58.0  Attached photo(s): https://westnordost.de/p/217908.jpg,7,1,PiaVespRoll,"Zudem wenn ich nur POI hinzufüge, wenn ich mich nicht irre, würde dann 2 verschiedene (z.B.) Läden zu sehen. Einmal Gebäude auf der Karte und einmal POI. Ist das nicht so? Hab das noch nicht getestet."
4289089,Liechtenstein,47.1399931,9.5225784,2024-06-12 00:00:00,2024-06-17 08:26:27,0,PiaVespRoll,Fritsch & Co  via StreetComplete_ee 58.0  Attached photo(s): https://westnordost.de/p/217907.jpg,2,0,mcliquid,Resolved with changeset https://www.openstreetmap.org/changeset/152790648 by noteSolver_plugin/0.5.0
4289087,Liechtenstein,47.1398468,9.5227004,2024-06-12 00:00:00,2024-06-17 08:25:41,0,PiaVespRoll,"Läderach chocolatier, baloise  via StreetComplete_ee 58.0  Attached photo(s): https://westnordost.de/p/217905.jpg",2,0,mcliquid,Resolved with changeset https://www.openstreetmap.org/changeset/152790626 by noteSolver_plugin/0.5.0
4289088,Liechtenstein,47.1398694,9.5221052,2024-06-12 00:00:00,2024-06-17 08:24:23,0,PiaVespRoll,You Shop  via StreetComplete_ee 58.0  Attached photo(s): https://westnordost.de/p/217906.jpg,2,0,mcliquid,Resolved with changeset https://www.openstreetmap.org/changeset/152790581 by noteSolver_plugin/0.5.0
4289091,Liechtenstein,47.1351551,9.5281371,2024-06-12 00:00:00,2024-06-16 17:34:12,0,PiaVespRoll,Unable to answer 'Who is allowed to park here? Parking may be free or paid.' – Parking Lot – https://osm.org/way/170759453 via StreetComplete_ee 58.0:  Kein Parkplatz  Attached photo(s): https://westnordost.de/p/217909.jpg,2,0,mcliquid,Resolved with changeset https://www.openstreetmap.org/changeset/152770629 by noteSolver_plugin/0.5.0
4289092,Liechtenstein,47.1275319,9.5386908,2024-06-12 00:00:00,2024-06-16 17:33:44,0,PiaVespRoll,Max 3 Std  via StreetComplete_ee 58.0  Attached photo(s): https://westnordost.de/p/217910.jpg,2,0,mcliquid,Resolved with changeset https://www.openstreetmap.org/changeset/152770616 by noteSolver_plugin/0.5.0
4254139,Liechtenstein,47.1392169,9.5227017,2024-05-19 00:00:00,2024-05-22 11:50:17,0,cdman,Unable to answer 'What are the opening hours here?' – Oettinger Davidoff (Tobacco Shop) – https://osm.org/node/4233957013 via StreetComplete 57.3:  It belongs to the clothing shop next door (You Fashion for Women & Men),2,0,mcliquid,Resolved with changeset https://www.openstreetmap.org/changeset/151672278 by noteSolver_plugin/0.5.0
