note_id,country_name,latitude,longitude,opened_at,closed_at,days_to_resolution,opened_by_username,opening_comment,total_comments,was_reopened,closed_by_username,closing_comment
CREATE FUNCTION
4854793,Ísland,64.0571258,-19.2436817,2025-07-14 00:00:00,2026-01-16 13:18:41,186,yelisey90,'name=Sómahús' OSM snapshot date: 2025-06-08T00:18:23Z POI has no name POI types: building  #organicmaps android,2,0,StVeit_Maps,Added
1013762,Ísland,64.0054434,-21.8566293,2017-05-30 00:00:00,2026-01-07 11:29:38,3144,samely,Can someone confirm if this path exists?,2,0,Martin Ligabue,"while possibly not official, lots of strava users go through this, I adjusted the offset and some parts, according to the majority of tracks"
5108398,Ísland,63.8144393,-22.7036535,2025-12-28 00:00:00,2026-01-07 11:26:04,10,einekleineEnte,'paid parking' OSM snapshot date: 2025-12-14T02:16:23Z POI has no name POI types: amenity-parking  #organicmaps android 2025.12.16-16-Google,2,0,Martin Ligabue,thanks
2526058,Ísland,63.4409287,-20.2698934,2021-02-05 00:00:00,2025-12-29 14:49:28,0,Mamutinka,"Forwarding anonymous report from #Mapy.cz user, please verify: The Brothers Brewery isn´t there.",2,0,Wanderer2000,The Brothers Brewery is not/ no longer mapped here
4290529,Ísland,65.9394246,-16.5423073,2024-06-13 00:00:00,2025-12-29 14:35:45,0,Unknown,New viewing point with paved walking path to it.,3,0,Wanderer2000,Viewpoint and path are already mapped
928554,Ísland,65.9834772,-17.4194108,2017-03-15 00:00:00,2025-12-29 14:30:04,0,rutildG,Æðafossar (OSM data version: 2017-02-15T16:20:03Z) #mapsme,2,0,Wanderer2000,already mapped nearby
2066641,Ísland,65.6848029,-18.1198829,2020-01-23 00:00:00,2025-12-29 14:25:25,0,Stalfur,"Need to split the building up for 3d modelling (height, color).  We have license to use imagery provided by ja.is https://ja.is/kort/?d=hashid%3AMb5xL&x=540463&y=576721&z=8&ja360=1&type=map&jh=195.4",4,1,Wanderer2000,"People are free to do 3d mapping for any building, so this note can be closed"
1785839,Ísland,65.6924311,-18.1077433,2019-05-20 00:00:00,2025-12-29 14:22:06,0,axline,This building is new and it's not yet on any publicly available imagery. Its position is approximate and needs to be specified. The address is correct though.,3,0,Wanderer2000,Building seems to be correct
1116667,Ísland,65.9568066,-23.1124044,2017-08-25 00:00:00,2025-12-29 14:16:25,0,freakyuser,Gästebuch,4,0,Wanderer2000,imo not relevant to be mapped
2997676,Ísland,65.6268197,-23.8257494,2022-01-05 00:00:00,2025-12-29 14:14:23,0,Unknown,There is a groserystore here,2,0,Wanderer2000,Convenience store is already mapped here
4084234,Ísland,64.9241000,-23.2565300,2024-01-24 00:00:00,2025-12-29 14:10:31,0,Tajtrdlik,"'Forwarding anonymous report from #Mapy.cz user, please verify: 'There is located Valeria Specialty Coffee'.  https://www.openstreetmap.org/way/203800030",2,0,Wanderer2000,already mapped
4828130,Ísland,64.7599644,-23.8801647,2025-06-27 00:00:00,2025-12-29 14:08:43,0,Gianmarco Brocchi,'Street temporarily closed to cars' OSM snapshot date: 2025-06-08T00:18:23Z POI name: Dritvíkurvegur POI types: psurface-paved_bad hwtag-nocycleway hwtag-nosidewalk highway-secondary  #organicmaps android,2,0,Wanderer2000,temporary closures are generally not mapped.
4604319,Ísland,64.7291502,-23.8016668,2025-01-27 00:00:00,2025-12-29 14:08:17,0,Fel_x3510,'Raketenleuchtturm' OSM snapshot date: 2024-07-23T19:32:09Z POI name: Malarrif POI types: place-locality  #organicmaps android,2,0,Wanderer2000,"The lighthouse is already mapped, more to the south"
2835281,Ísland,64.8442128,-22.6530908,2021-09-04 00:00:00,2025-12-29 14:05:36,0,Marco Fogg,'Snaefellsnes Visite Center' POI has no name POI types: amenity-toilets OSM data version: 2021-07-29T10:41:28Z  #organicmaps,2,0,Wanderer2000,Tourist information centre is already mapped
4812038,Ísland,64.3210000,-22.0609000,2025-06-18 00:00:00,2025-12-29 13:58:32,0,Unknown,Akranes,2,0,Wanderer2000,not useful note
3868482,Ísland,64.3204200,-22.0681100,2023-09-03 00:00:00,2025-12-29 13:58:00,0,kremkex,"The store here is Módel, it used to be affiliated with Tölvulistinn but that ended many years ago. Módel does not sell computers any longer.",2,0,Wanderer2000,Name has already been updated
1901337,Ísland,64.3177748,-22.0823252,2019-08-26 00:00:00,2025-12-29 13:57:29,0,xDeedy,"The place has gone or never existed. This is an auto-generated note from MAPS.ME application: a user reports a POI that is visible on a map (which can be outdated), but cannot be found on the ground. (OSM data version: 2016-07-15T17:38:02Z) #mapsme",2,0,Wanderer2000,Not sure what this note is referring to. The closed POI has been updated more recently than this note.
1249470,Ísland,64.1654067,-21.6971064,2017-12-26 00:00:00,2025-12-29 13:55:10,0,gillisig,'Not fast food but fish market.' POI name: Fiskbúðin POI types: amenity-fast_food OSM data version: 2017-12-08T15:42:02Z  #mapsme,2,0,Wanderer2000,already mapped
3991396,Ísland,64.1655200,-21.7149900,2023-11-17 00:00:00,2025-12-29 13:54:44,0,elvarb,Update needed to add newly built houses and road,2,0,Wanderer2000,houses and roads have already been mapped
4623470,Ísland,64.1496810,-21.9433530,2025-02-11 00:00:00,2025-12-29 13:50:21,0,cEvLGWiQ,Online sources shows that this restaurant is no longer in business. It is now an Indian cuisine restaurant.,2,0,Wanderer2000,has already been updated
3841437,Ísland,64.1334354,-21.9288146,2023-08-18 00:00:00,2025-12-29 13:47:56,0,Crsi,Completed street with sidewalks on both sides  via StreetComplete 53.3  Attached photo(s): https://westnordost.de/p/169013.jpg,2,0,Wanderer2000,has already been mapped
4238278,Ísland,64.1295000,-21.9406000,2024-05-09 00:00:00,2025-12-29 13:46:51,0,Unknown,Aug 9 - land,2,0,Wanderer2000,unclear what this means
3474088,Ísland,64.2366831,-21.6567525,2022-12-11 00:00:00,2025-12-16 17:25:20,0,Yan Bakhmat,"'Місто знаходиться зовсім в іншому місці.' The place has gone or never existed. A user of Organic Maps application has reported that the POI was visible on the map (see snapshot date below), but was not found on the ground. OSM snapshot date: 2022-11-19T09:11:52Z POI name: Reykjavíkurborg POI types: place-city-capital-2 place-city-capital-6  #organicmaps",2,0,Yan Bakhmat,
4830082,Ísland,63.9905022,-16.4536730,2025-06-28 00:00:00,2025-12-06 18:04:41,0,Sébastien Pi,path on that way (POV?)  #OsmAnd,2,0,Sébastien Pi,Got it on aerial view
4854814,Ísland,65.5965756,-23.9875953,2025-07-14 00:00:00,2025-12-06 16:56:31,0,PlayGuide,"Il existe ici une aire de jeux (structure, slide, climbingframe, zipwire, swing, basketswing) signalée via l'appli #PlayGuide :  https://playguide.eu/app/playground/6b119518-d126-462b-b4d6-c714ab2208b3",2,0,cpa8,ok
4372004,Ísland,64.1545985,-21.9441320,2024-08-07 00:00:00,2025-12-02 02:37:42,0,MichaP,Unable to answer 'Is this still here?' – Íslenski sjávarklasinn (Quasi-NGO Office) – https://osm.org/node/2963718533 via StreetComplete 58.2:  Sjavar Klasinn - Ocean Cluster House  a marine innovation hub with over 50 enterprises.,2,0,たかちょ,
4961726,Ísland,64.0635103,-21.9636050,2025-09-14 00:00:00,2025-11-27 09:58:58,0,crataegus,Unable to answer 'What’s the surface here?' – on bridge: Foot Path – https://osm.org/way/222827396 via StreetComplete 61.3:  This isn't a path or bridge. Its a pipe or structural member for securing the other end of the jetty,2,0,martin-kokos,Removed. Leaving the other path assuming it's access to the pier.
702983,Ísland,64.0848363,-21.9573876,2016-09-06 00:00:00,2025-11-27 09:56:28,0,Kjarrval,Bus stop approx. here.,4,0,martin-kokos,Already added https://www.openstreetmap.org/node/11935496437/history
702986,Ísland,64.0892162,-21.9820812,2016-09-06 00:00:00,2025-11-27 09:55:56,0,Kjarrval,Bus stop approx. here.,2,0,martin-kokos,Already added https://www.openstreetmap.org/node/11935496431/history
4680868,Ísland,64.0822177,-21.8901211,2025-03-24 00:00:00,2025-11-27 09:52:52,0,Crsi,"Here is a map of the disc golf course, facing south  via StreetComplete 60.2  Attached photo(s): https://streetcomplete.app/p/267443.jpg",2,0,martin-kokos,Already mapped https://www.openstreetmap.org/node/7016700143/history
4884224,Ísland,65.6466460,-16.8221766,2025-07-30 00:00:00,2025-11-25 09:25:22,0,alš,Not possible to drive onto from road. Not a parking.  #OsmAnd,2,0,Kookykooky,
4837065,Ísland,63.9247626,-20.6753569,2025-07-03 00:00:00,2025-11-21 02:21:47,0,Pan Perníček,"Forwarding anonymous report from #mapycom user, please verify: Fee is 750 ISK.  https://www.openstreetmap.org/way/499530221",2,0,Marida Denofsky,
4857029,Ísland,64.0482842,-16.1792043,2025-07-15 00:00:00,2025-11-20 06:35:51,0,yelisey90,"'move the building to the place of Heimahumar Langoustine, move both fast foods a bit to the north' OSM snapshot date: 2025-06-08T00:18:23Z POI has no name POI types: building fee-no wheelchair-yes amenity-toilets  #organicmaps android",4,1,yelisey90,relocated the building & the rest
4857027,Ísland,64.0481355,-16.1789414,2025-07-15 00:00:00,2025-11-20 06:31:48,0,yelisey90,'Fancy Sheep now' OSM snapshot date: 2025-06-08T00:18:23Z POI has no name POI types: amenity-fast_food  #organicmaps android,4,0,yelisey90,fixed
4857028,Ísland,64.0479535,-16.1788127,2025-07-15 00:00:00,2025-11-19 08:55:50,0,yelisey90,'+soup' OSM snapshot date: 2025-06-08T00:18:23Z POI has no name POI types: amenity-fast_food cuisine-hotdog  #organicmaps android,2,0,Tomas09,https://www.openstreetmap.org/changeset/174848735#map=19/64.048292/-16.179278&layers=N
3888560,Ísland,64.0125742,-16.3626240,2023-09-14 00:00:00,2025-11-19 08:45:15,0,Cody Swanson,Unable to answer 'What surface does this piece of road have?' for https://osm.org/way/48743949 via StreetComplete 53.3:  Road no longer accessible,2,0,Tomas09,https://www.openstreetmap.org/changeset/174848330#map=15/64.01234/-16.36625&layers=N
3742030,Ísland,64.0159810,-16.3666839,2023-06-19 00:00:00,2025-11-19 08:45:11,0,mrmaxguns,Unable to answer 'Do you have to pay to use this restroom?' for https://osm.org/way/722967294 via StreetComplete 53.1:  Restrooms are paid for general public but free for boat customers,2,0,Tomas09,https://www.openstreetmap.org/changeset/174848330#map=15/64.01234/-16.36625&layers=N
1934376,Ísland,64.7250942,-16.6537648,2019-09-21 00:00:00,2025-11-19 08:35:02,0,Reisemobilist,"'has moved' The place has gone or never existed. This is an auto-generated note from MAPS.ME application: a user reports a POI that is visible on a map (which can be outdated), but cannot be found on the ground. POI has no name POI types: amenity-parking OSM data version: 2019-08-30T18:41:13Z  #mapsme",2,0,Tomas09,👌
3424742,Ísland,64.7104480,-20.8010727,2022-11-02 00:00:00,2025-10-31 02:52:33,0,Pan Perníček,"Forwarding anonymous report from #Mapy.cz user, please verify: There's a waterfall.",2,0,Ybizu,
1749553,Ísland,64.5850092,-20.7903371,2019-04-18 00:00:00,2025-10-30 20:33:14,0,sdana,Abzweig piste 551 zum Langjökull (OSM data version: 2016-06-20T05:57:02Z) #mapsme,3,0,Kay Klotzsche,"Yes, current OSM is correct. I was there in August."
4948798,Ísland,64.2642112,-20.5166535,2025-09-06 00:00:00,2025-10-28 20:49:33,0,Kay Klotzsche,Unable to answer 'What’s the surface firmness of this track?' – Track / Land-Access Road – https://osm.org/way/1309809612 via StreetComplete 61.3:  Fenced off  Attached photo(s): https://streetcomplete.app/p/303429.jpg,2,0,Kay Klotzsche,removed
4948796,Ísland,63.8296952,-21.0282874,2025-09-06 00:00:00,2025-10-28 20:46:26,0,Kay Klotzsche,Parking spot here  via StreetComplete 61.3,2,0,Kay Klotzsche,added P
4948797,Ísland,63.8343941,-21.0595897,2025-09-06 00:00:00,2025-10-28 20:45:17,0,Kay Klotzsche,Parking here  via StreetComplete 61.3,2,0,Kay Klotzsche,added parking
4948799,Ísland,63.9036266,-21.0664824,2025-09-06 00:00:00,2025-10-28 20:44:10,0,Kay Klotzsche,This road is signed as 34. OSM seems to have it wrong as 310.  via StreetComplete 61.3,2,0,Kay Klotzsche,ok now
4948795,Ísland,64.0550938,-19.0280248,2025-09-06 00:00:00,2025-10-28 20:34:08,0,Kay Klotzsche,Here is a footpath to the top of the mountain at the sea. Should be mapped using satellite map  via StreetComplete 61.3,2,0,Kay Klotzsche,added  footpath to the top of the mountain
4948790,Ísland,63.9944779,-18.9916975,2025-09-06 00:00:00,2025-10-28 20:30:30,0,Kay Klotzsche,Unable to answer 'What kind of parking is this?' – Parking Lot – https://osm.org/node/4383509593 via StreetComplete 61.3:  Not really  a parking place here,2,0,Kay Klotzsche,removed P
4943564,Ísland,65.8151855,-16.3833691,2025-09-02 00:00:00,2025-10-28 20:26:58,0,Kay Klotzsche,The path to the rest is fenced off. Solid be deleted from the map to the next junction.  via StreetComplete 61.3,2,0,Kay Klotzsche,removed
4943562,Ísland,65.8150448,-16.3827132,2025-09-02 00:00:00,2025-10-28 20:26:54,0,Kay Klotzsche,This path has been fenced off  via StreetComplete 61.3  Attached photo(s): https://streetcomplete.app/p/302889.jpg,2,0,Kay Klotzsche,removed
4943563,Ísland,65.8151613,-16.3834775,2025-09-02 00:00:00,2025-10-28 20:26:32,0,Kay Klotzsche,The path southward is fenced off. Should be deleted from the map.  via StreetComplete 61.3,2,0,Kay Klotzsche,removed path
4943561,Ísland,65.8178957,-16.3799329,2025-09-02 00:00:00,2025-10-28 20:22:07,0,Kay Klotzsche,In context of overlay 'Surfaces' – Path – https://osm.org/way/35776726 via StreetComplete 61.3:  Not really there anymore,2,0,Kay Klotzsche,removed
4943560,Ísland,66.0200913,-17.3664378,2025-09-02 00:00:00,2025-10-28 20:21:19,0,Kay Klotzsche,New Building here. Observation but  via StreetComplete 61.3,2,0,Kay Klotzsche,added building hut
4675619,Ísland,65.6860487,-17.5420566,2025-03-22 00:00:00,2025-10-28 20:18:20,0,Crsi,Gate type?  via StreetComplete 60.2  Attached photo(s): https://streetcomplete.app/p/266791.jpg,4,0,Kay Klotzsche,
4676969,Ísland,65.6853000,-17.5391066,2025-03-22 00:00:00,2025-10-28 20:17:38,0,Crsi,Closed in winter  via StreetComplete 60.2  Attached photo(s): https://streetcomplete.app/p/266957.jpg,2,0,Kay Klotzsche,set seasonal=summer
4943559,Ísland,65.6836122,-17.5460320,2025-09-02 00:00:00,2025-10-28 20:16:58,0,Kay Klotzsche,"Upgrade all paths to pedestrian ways, except the T2 trail below the stairs  via StreetComplete 61.3",2,0,Kay Klotzsche,updated
4470213,Ísland,65.6833722,-17.5475040,2024-10-08 00:00:00,2025-10-28 20:14:18,0,John Gilmore,This path is closed.  via StreetComplete 59.1  Attached photo(s): https://westnordost.de/p/244949.jpg https://westnordost.de/p/244950.jpg https://westnordost.de/p/244951.jpg https://westnordost.de/p/244952.jpg,4,0,Kay Klotzsche,seasonal=summer
4943558,Ísland,65.6132258,-16.8762149,2025-09-02 00:00:00,2025-10-28 20:11:20,0,Kay Klotzsche,Surface is plastic grid  via StreetComplete 61.3  Attached photo(s): https://streetcomplete.app/p/302887.jpg,2,0,Kay Klotzsche,set to grass_paver
4934092,Ísland,64.7530977,-20.8012605,2025-08-28 00:00:00,2025-10-28 20:01:58,0,Kay Klotzsche,Very new building here. Maybe update according to arieal picture.  Move toilets into this new building  via StreetComplete 61.3  Attached photo(s): https://streetcomplete.app/p/301628.jpg,2,0,Kay Klotzsche,updated
4386059,Ísland,65.6246321,-16.9166849,2024-08-16 00:00:00,2025-10-26 21:33:34,0,schoschi,"New Billings in construction. when finished, map them",2,0,Mariusz Dykierek,Changeset 73813074
5010135,Ísland,66.0749887,-23.1294128,2025-10-17 00:00:00,2025-10-17 11:47:53,0,Helga Magnusdottir,Útihreystitæki.,2,0,NeisReview,No actionable information was provided for editing OpenStreetMap data. Please feel free to reopen this note with more details. #noeditinfo
5010145,Ísland,65.8807265,-23.4930637,2025-10-17 00:00:00,2025-10-17 11:47:46,0,Helga Magnusdottir,Útihreystitæki.,2,0,NeisReview,No actionable information was provided for editing OpenStreetMap data. Please feel free to reopen this note with more details. #noeditinfo
4895708,Ísland,65.2871441,-14.4304857,2025-08-06 00:00:00,2025-10-14 21:58:02,0,Unknown,Bus stop Fjölnotahus Fellabaer can be viewed here: https://maps.app.goo.gl/N15n3sacp4iRWA4k8,2,0,Kerploonk,
4895698,Ísland,65.2871509,-14.4305125,2025-08-06 00:00:00,2025-10-14 21:57:58,0,Unknown,Bus stop Fjölnotahús Fellabæ is located here. Not at the Fellavöllur location.,2,0,Kerploonk,
4895711,Ísland,65.2871262,-14.4305688,2025-08-06 00:00:00,2025-10-14 21:57:55,0,Unknown,Bus stop Fellabaer Fjölnotahus can be viewed here as well: https://maps.app.goo.gl/GX2bzmP63QPVdC51A,2,0,Kerploonk,
4895719,Ísland,65.2849608,-14.4286296,2025-08-06 00:00:00,2025-10-14 21:55:41,0,Unknown,There is no bus stop visible here:  https://maps.app.goo.gl/UuEUEWLWNCch3FUq5  I think this bus stop should be deleted and added/removed on the other location I wrote notes on.,2,0,Kerploonk,
2895194,Ísland,64.0375768,-22.0416641,2021-10-14 00:00:00,2025-10-14 21:30:49,0,Unknown,Þorbjarnarstaðir,2,0,Kerploonk,
4995293,Ísland,64.1378575,-21.9569266,2025-10-07 00:00:00,2025-10-14 21:20:22,0,Gianmarco Brocchi,"'Place does not exist anymore, by local inspection ' The place has gone or never existed. A user of Organic Maps application has reported that the POI was visible on the map (see snapshot date below), but was not found on the ground. OSM snapshot date: 2025-09-13T21:01:41Z POI name: Björnsbakarí Vesturbæ POI types: shop-bakery  #organicmaps android 2025.10.05-7-Google",2,0,Kerploonk,
4911277,Ísland,64.7071504,-16.9923682,2025-08-15 00:00:00,2025-10-13 05:04:35,0,Eirikur Kristins,'Skarð í Kömbunum' OSM snapshot date: 2025-08-08T13:08:07Z POI name: Vatnajökulsþjóðgarður POI types: boundary-national_park leisure-nature_reserve  #organicmaps android,2,0,Lumikeiju,Closing - duplicate of https://www.openstreetmap.org/note/4911278
4087772,Ísland,63.5429790,-19.6630210,2024-01-26 00:00:00,2025-10-11 20:36:04,0,Unknown,"'This parking is replaced by the parking on the other side of the street.There are signs of the owner' The place has gone or never existed. A user of Organic Maps application has reported that the POI was visible on the map (see snapshot date below), but was not found on the ground. OSM snapshot date: 2024-01-05T19:06:54Z POI has no name POI types: amenity-parking  #organicmaps android",2,0,Mariusz Dykierek,
4949025,Ísland,63.8830868,-22.4485827,2025-09-06 00:00:00,2025-10-11 13:29:32,0,Kay Klotzsche,Packing lot needs new mapping. It has been reconstructed and moved north west  via StreetComplete 61.3,2,0,Ybizu,
4884474,Ísland,65.7139983,-18.1671336,2025-07-30 00:00:00,2025-10-10 19:06:53,0,alš,Permanent traffic speed camera is here. Approximate location.  #OsmAnd,2,0,Mariusz Dykierek,
3846760,Ísland,65.3916697,-20.9384933,2023-08-21 00:00:00,2025-10-07 22:24:28,0,maraf24,fire station,2,0,tomasbergsteinn,
4674946,Ísland,65.3915920,-20.9386571,2025-03-21 00:00:00,2025-10-07 22:24:24,0,Crsi,Fire station note confirmed  via StreetComplete 60.2  Attached photo(s): https://streetcomplete.app/p/266667.jpg,2,0,tomasbergsteinn,Brunavarnir Húnaþings Vestra is the Municipality's fire station.
4104812,Ísland,63.5661028,-19.6076963,2024-02-08 00:00:00,2025-09-27 12:31:30,0,Unknown,"Seljavallalaug pool is the oldest swimming pool in Iceland. The pool was built in 1923 by Björn Andrésson and others who wanted to provide the locals of Seljavellir with a place to learn to swim. Since 1927, swimming lessons were conducted in the pool as a part of compulsory education.",2,0,dom74,
4964829,Ísland,63.5260193,-19.5121105,2025-09-16 00:00:00,2025-09-27 12:18:50,0,Unknown,cette route est fermée plus d'accès vehicule,2,0,dom74,ok
1480247,Ísland,63.8930031,-16.5942600,2018-08-06 00:00:00,2025-09-26 17:07:21,0,Paaaxli,"The place has gone or never existed. This is an auto-generated note from MAPS.ME application: a user reports a POI that is visible on a map (which can be outdated), but cannot be found on the ground. POI has no name POI types: tourism-camp_site OSM data version: 2018-07-05T18:22:02Z  #mapsme",3,0,Sébastien Pi,No camp site here
4830080,Ísland,63.9895970,-16.4506167,2025-06-28 00:00:00,2025-09-26 17:00:24,0,Sébastien Pi,There is a path on that way.  #OsmAnd,2,0,Sébastien Pi,Seems informat. Nothing on aerial view
4830081,Ísland,63.9893845,-16.4520589,2025-06-28 00:00:00,2025-09-26 16:58:09,0,Sébastien Pi,There is a river here and a ford (at least in summer)  #OsmAnd,2,0,Sébastien Pi,
4964653,Ísland,63.4082354,-19.1143580,2025-09-16 00:00:00,2025-09-26 16:44:10,0,Unknown,camera parka,2,0,dom74,
4948794,Ísland,63.9945750,-19.0600542,2025-09-06 00:00:00,2025-09-26 15:18:53,0,Kay Klotzsche,Foot path  via StreetComplete 61.3  Attached photo(s): https://streetcomplete.app/p/303428.jpg  GPS Trace: https://www.openstreetmap.org/user/Kay%20Klotzsche/traces/12058649,2,0,Ybizu,
4948793,Ísland,63.9943158,-19.0609484,2025-09-06 00:00:00,2025-09-26 15:17:59,0,Kay Klotzsche,Wooden bridge  via StreetComplete 61.3  Attached photo(s): https://streetcomplete.app/p/303427.jpg,2,0,Ybizu,fixed
4948791,Ísland,63.9941195,-19.0609062,2025-09-06 00:00:00,2025-09-26 15:17:51,0,Kay Klotzsche,Wooden path  via StreetComplete 61.3  Attached photo(s): https://streetcomplete.app/p/303425.jpg  GPS Trace: https://www.openstreetmap.org/user/Kay%20Klotzsche/traces/12058648,2,0,Ybizu,"thx, fixed"
4944740,Ísland,64.3112317,-20.3025809,2025-09-03 00:00:00,2025-09-25 15:53:34,0,ulore22,Hot spring missing  via StreetComplete 61.3  Attached photo(s): https://streetcomplete.app/p/302967.jpg,2,0,dom74,ok
4454804,Ísland,64.0199021,-16.9797980,2024-09-27 00:00:00,2025-09-25 15:19:25,0,VioletCancer,This path is no longer open  via StreetComplete 59.0  Attached photo(s): https://westnordost.de/p/242548.jpg https://westnordost.de/p/242549.jpg,2,0,dom74,ok
4963289,Ísland,63.9888266,-16.3967095,2025-09-15 00:00:00,2025-09-24 17:15:01,0,Unknown,les caméra de Parka se trouve à cette endroit sur la route,2,0,dom74,
4931617,Ísland,64.0268729,-21.2119291,2025-08-26 00:00:00,2025-09-23 17:32:18,0,Kay Klotzsche,Mud pool  via StreetComplete 61.3  Attached photo(s): https://streetcomplete.app/p/301282.jpg,2,0,dom74,ok
2922078,Ísland,64.1127125,-21.9053087,2021-11-04 00:00:00,2025-09-22 12:27:29,0,Unknown,onosm.org submitted note from a business: name: Stjörnusól Sólbaðsstofa phone: 5557272 website: http://solbadsstofa.is twitter:  facebook: http://facebook.com/stjornusol email: pall@sportsol.is hours: Mán - Fös 12:00 til 23:00 Lau - Sun 13:00 til 22:00 category: Tanning Salons address: Hamraborg 1-3,2,0,Kristján Kakali Vattnes Ingólfsson,its true
4970512,Ísland,63.8170108,-22.6968717,2025-09-20 00:00:00,2025-09-21 16:20:38,0,Unknown,position des caméra parka,2,0,dom74,
3799503,Ísland,63.8125724,-22.7161592,2023-07-26 00:00:00,2025-09-21 16:17:53,0,Unknown,"Volcano Man Keyboards 63.81257279990911,-22.716160671785435",2,0,dom74,ok
4943103,Ísland,63.4172314,-18.9990802,2025-09-02 00:00:00,2025-09-20 12:39:11,0,ulore22,Free water refill in kronan  via StreetComplete 61.3,2,0,Ybizu,
4932958,Ísland,64.2425160,-21.1852367,2025-08-27 00:00:00,2025-09-16 15:24:47,0,Kay Klotzsche,Footpath  via StreetComplete 61.3  Attached photo(s): https://streetcomplete.app/p/301482.jpg  GPS Trace: https://www.openstreetmap.org/user/Kay%20Klotzsche/traces/12049251,2,0,Thingvellir_Gunnar,
393479,Ísland,64.2411074,-21.1780357,2015-07-09 00:00:00,2025-09-16 15:24:07,0,Unknown,Bústaðurinn,2,0,Thingvellir_Gunnar,
4465500,Ísland,64.2424804,-21.0259589,2024-10-05 00:00:00,2025-09-16 15:23:52,0,John Gilmore,"Unable to answer 'What kind of parking is this?' – Parking Lot – https://osm.org/node/846980671 via StreetComplete 59.1:  There is no parking lot here, just road & vegetation",2,0,Thingvellir_Gunnar,
4932959,Ísland,64.2558333,-21.1236320,2025-08-27 00:00:00,2025-09-16 15:23:34,0,Kay Klotzsche,Unable to answer 'What’s the topic of this information board?' – Information Board – https://osm.org/node/13100826693 via StreetComplete 61.3:  This is about history,2,0,Thingvellir_Gunnar,
4073008,Ísland,64.2822000,-21.0934000,2024-01-17 00:00:00,2025-09-16 15:23:26,0,Tajtrdlik,"Forwarding anonymous report from #Mapy.cz user, please verify: 'There is located Hvannagjá - rock formation, tourist atraction.'",2,0,Thingvellir_Gunnar,
4802825,Ísland,64.2795281,-21.0878332,2025-06-12 00:00:00,2025-09-16 15:23:14,0,IgorAdz,'туалет бесплатно' OSM snapshot date: 2025-05-11T16:17:16Z POI has no name POI types: psurface-paved_good highway-service-parking_aisle  #organicmaps android,2,0,Thingvellir_Gunnar,
711392,Ísland,64.2777913,-21.0924882,2016-09-13 00:00:00,2025-09-16 15:23:06,0,Wichian Pongtiyapaiboon,Hakid viewpoint (OSM data version: 2016-08-22T09:03:02Z) #mapsme,2,0,Thingvellir_Gunnar,
4932960,Ísland,64.2942817,-21.0570149,2025-08-27 00:00:00,2025-09-16 15:22:09,0,Kay Klotzsche,Footpath  via StreetComplete 61.3  GPS Trace: https://www.openstreetmap.org/user/Kay%20Klotzsche/traces/12049252,2,0,Thingvellir_Gunnar,
4964177,Ísland,63.8800510,-22.4492850,2025-09-16 00:00:00,2025-09-16 08:08:19,0,AnnaHayward10,Lagon Blue,2,0,AnnaHayward10,
3983733,Ísland,63.8696000,-22.3796000,2023-11-11 00:00:00,2025-09-15 13:37:00,0,kuhni74,ele ca. 120m?,3,1,D-Nort,
4859768,Ísland,65.0865482,-14.8861930,2025-07-16 00:00:00,2025-09-14 16:33:30,0,yelisey90,"'fence at southern end, restricted access' OSM snapshot date: 2025-07-08T15:45:36Z POI has no name POI types: highway-path  #organicmaps android",2,0,Ybizu,deleted this path.
4955437,Ísland,64.2744155,-15.0090408,2025-09-10 00:00:00,2025-09-10 08:33:30,0,Juanjofero,Vestrahorn,3,1,Juanjofero,
4952363,Ísland,63.8288930,-17.7270198,2025-09-08 00:00:00,2025-09-08 09:54:52,0,jmbarrero,Stracta Apartments Orustustaðir,2,0,jmbarrero,
