note_id,country_name,latitude,longitude,opened_at,closed_at,days_to_resolution,opened_by_username,opening_comment,total_comments,was_reopened,closed_by_username,closing_comment
4294830,Ísland,64.1308697,-21.8772855,2024-06-16 00:00:00,2024-07-25 11:12:58,0,Kjarrval,Replaced by Dirty Burger & Ribs  #OsmAnd,2,0,Kjarrval,Change implemented.
439750,Ísland,65.7416289,-19.6406311,2015-09-23 00:00:00,2024-07-22 19:53:16,0,Unknown,Fab Lab Sauðárkrókur,2,0,der_andere,tried to add
2526506,Ísland,65.7438526,-19.6093243,2021-02-05 00:00:00,2024-07-22 19:44:18,0,Mamutinka,"Forwarding anonymous report from #Mapy.cz user, please verify: Nie ma żadnego statku, to po prostu zwykła plaża.",2,0,der_andere,Pictures suggest it might only be visible in low tide conditions.
3463241,Ísland,65.8822246,-19.7362894,2022-12-01 00:00:00,2024-07-22 19:40:51,0,Pan Perníček,"Forwarding anonymous report from #Mapy.cz user, please verify: Hot spring is not accessible.  https://www.openstreetmap.org/node/3606771480",2,0,der_andere,"edited wheelchair accessability, it is not accessible"
2785248,Ísland,65.8811766,-19.7356861,2021-08-03 00:00:00,2024-07-22 19:35:40,0,TPHA,"Ferry to Drangey not going from here anymore, but from Saudarkrokur instead",2,0,der_andere,"Thank you TPHA, I saw that during a vacation, got home and fixed it."
1207156,Ísland,64.1343017,-21.8757495,2017-11-15 00:00:00,2024-07-21 22:40:25,0,Stalfur,'lítið m' POI name: Félag Múslima á Íslandi POI types: amenity-place_of_worship-muslim OSM data version: 2017-10-20T12:20:02Z  #mapsme,2,0,Crsi,The POI for the place of worship has already been added. I'm closing this note as resolved.
619415,Ísland,64.1242427,-21.7772918,2016-07-07 00:00:00,2024-07-21 22:36:36,0,Kjarrval,Missing building.,2,0,Crsi,Here is a parking lot and not a building. I've updated it according to aerial imagery that is newer than this note. Closing as resolved.
4252272,Ísland,64.2668555,-21.1156066,2024-05-18 00:00:00,2024-07-21 02:27:49,0,Crsi,Incline reversed  via StreetComplete 57.4,2,0,Crsi,The incline has been fixed. Closing as resolved.
4342694,Ísland,64.1499736,-21.7947297,2024-07-20 00:00:00,2024-07-21 01:48:35,0,Crsi,Underground parking entrance  via StreetComplete 58.1,2,0,Crsi,Closing as resolved.
4342696,Ísland,64.1507455,-21.7920835,2024-07-20 00:00:00,2024-07-21 01:47:49,0,Crsi,Add footway suitable for wheelchair as ramp for stairs towards entrance  via StreetComplete 58.1,2,0,Crsi,I've addressed this issue. Closing as resolved.
4342693,Ísland,64.1363950,-21.8095875,2024-07-20 00:00:00,2024-07-21 01:33:41,0,Crsi,Stairs x2  via StreetComplete 58.1  Attached photo(s): https://westnordost.de/p/225943.jpg,2,0,Crsi,I've fixed it. Closing this note.
1597650,Ísland,64.1285043,-21.8499291,2018-11-22 00:00:00,2024-07-21 01:18:38,0,Morten Lange,Leiðastytting. path. informal=yes,2,0,Crsi,I confirmed this path and added it. Closing note as resolved.
4340233,Ísland,64.1557600,-21.8691100,2024-07-19 00:00:00,2024-07-21 01:11:27,0,Unknown,Skarfaklettur beach,2,0,Crsi,"Hello. Thank you for reporting this. After checking, I have added the name to the beach. Note that the name of the rock was already  present, thus searching for it was already possible."
4328818,Ísland,63.8192235,-22.6842134,2024-07-11 00:00:00,2024-07-19 13:54:10,0,heavygale,Unable to answer 'What’s the surface here?' – Foot Path – https://osm.org/way/1219898851 via StreetComplete 58.2:  It's a wooden boardwalk.  Attached photo(s): https://westnordost.de/p/223662.jpg,2,0,heavygale,/changeset/154144709
4328817,Ísland,63.8185122,-22.6846067,2024-07-11 00:00:00,2024-07-19 13:54:09,0,heavygale,Unable to answer 'What’s the surface here?' – Foot Path – https://osm.org/way/369002947 via StreetComplete 58.2:  It's a wooden boardwalk.  Attached photo(s): https://westnordost.de/p/223661.jpg,2,0,heavygale,/changeset/154144709
4339385,Ísland,65.3986657,-20.9432237,2024-07-18 00:00:00,2024-07-19 13:51:10,0,heavygale,"Unable to answer 'How many car lanes does this road have?' – Skólavegur (Residential Road) – https://osm.org/way/197456009 via StreetComplete 58.2:  It's only a sidewalk, as the street is already mapped to the north west  Attached photo(s): https://westnordost.de/p/225460.jpg",2,0,heavygale,/changeset/154144543
4339407,Ísland,65.3971487,-20.9444766,2024-07-18 00:00:00,2024-07-19 13:42:12,0,heavygale,DiscGolf spot could be mapped here  via StreetComplete 58.2  Attached photo(s): https://westnordost.de/p/225462.jpg,2,0,heavygale,/changeset/154144200
4334705,Ísland,64.5215742,-21.4722633,2024-07-15 00:00:00,2024-07-16 05:19:01,0,Unknown,We are here,2,0,mavl,This note does not contain a useful information for OpenStreetMap.
2555107,Ísland,64.1463518,-21.9319901,2021-02-25 00:00:00,2024-07-11 22:17:17,0,Arkaroo,Unable to answer 'Are these opening hours for Thor (Gift Shop) still correct?' for https://osm.org/node/6813016608 via StreetComplete 29.1:  now an epal store,3,0,KarlP,"Yes, epal now"
667863,Ísland,66.0520714,-17.3437586,2016-08-11 00:00:00,2024-07-05 19:17:35,0,malou-bzh,Wc / Douches / Cuisine (OSM data version: 2016-07-15T17:38:02Z) #mapsme,2,0,amtti,
4316084,Ísland,64.1216831,-16.0704866,2024-07-02 00:00:00,2024-07-02 23:34:47,0,Diegovano,Lake,5,0,Diegovano,
4316083,Ísland,64.1215734,-16.0694956,2024-07-02 00:00:00,2024-07-02 23:34:41,0,Diegovano,Dining end,2,0,Diegovano,
4316085,Ísland,64.1213602,-16.0691328,2024-07-02 00:00:00,2024-07-02 23:34:36,0,Diegovano,Dining begin,2,0,Diegovano,
4316082,Ísland,64.1211887,-16.0687954,2024-07-02 00:00:00,2024-07-02 23:34:33,0,Diegovano,Dining area begin,3,0,Diegovano,
4316079,Ísland,64.1209483,-16.0683611,2024-07-02 00:00:00,2024-07-02 23:34:27,0,Diegovano,Corner,2,0,Diegovano,
4302866,Ísland,65.7717553,-17.2694832,2024-06-22 00:00:00,2024-06-22 12:51:40,0,Helga Gísla,Veiðiheimilið Rauðhólar. SVFR,3,1,Helga Gísla,
4230960,Ísland,64.3241909,-22.0440245,2024-05-05 00:00:00,2024-06-18 21:20:36,0,Kerploonk,School building here. Add when imagery is updated.,2,0,Kerploonk,
1725885,Ísland,64.1434269,-21.9171660,2019-03-27 00:00:00,2024-06-18 20:53:45,0,pallih,Height=3.5  via StreetComplete 9.0  Attached photo(s): https://westnordost.de/p/2129.jpg,2,0,Kerploonk,
2031565,Ísland,64.1655626,-21.6986493,2019-12-19 00:00:00,2024-06-18 20:44:24,0,Unknown,Bónus Supermarket missing,2,0,Kerploonk,
1276064,Ísland,64.1680000,-21.8015000,2018-01-22 00:00:00,2024-06-18 20:43:40,0,Neisti,Dogs are allowed on Geldinganes without a leash (under supervision). Should this be mapped and tagged as leisure=dog_park? Sources: http://reykjavik.is/sites/default/files/skjol_thjonustulysingar/hundasam_ykkt2012.pdf and http://borgarvefsja.reykjavik.is/borgarvefsja/# (See 'Þjónusta > Hundasvæði - lausaganga hunda'.),2,0,Kerploonk,
3069943,Ísland,64.8422973,-22.5829124,2022-03-01 00:00:00,2024-06-14 02:02:26,0,Unknown,uytyfilg,2,0,kriksis,
2170537,Ísland,64.6807700,-21.7147400,2020-04-24 00:00:00,2024-06-02 20:25:23,0,Unknown,Gljúfurárbústaður,19,1,kealeynate,
3262827,Ísland,64.6583510,-21.7114401,2022-07-11 00:00:00,2024-06-01 21:52:13,0,hoschiCZ,"'survey' The place has gone or never existed. A user of Organic Maps application has reported that the POI was visible on the map (see snapshot date below), but was not found on the ground. OSM snapshot date: 2022-06-13T12:43:18Z POI has no name POI types: highway-rest_area  #organicmaps",2,0,Crsi,Closing this note as resolved. I have surveyed the area and confirmed that it still exists.
4066027,Ísland,64.1659700,-21.7004500,2024-01-13 00:00:00,2024-05-26 14:01:43,0,SigRagnars,I live here :-),2,0,Crsi,"Hello SigRagnars and welcome to OpenStreetMap. Thanks for letting everyone know where you live, but I will close this note, since OpenStreetMap is not an address book. OSM is a map of the world, and it contains postal addresses, but no personal information like where someone lives. Thank you for your understanding. Kind regards, Crsi"
4245033,Ísland,64.1444000,-21.8140000,2024-05-14 00:00:00,2024-05-26 13:27:23,0,Crsi,"Revisit and record disc golf course here, if it still exists. Create GPS tracks of holes. Ref Way 297253722.",4,1,Osskross,
4261610,Ísland,64.3085871,-22.0945720,2024-05-23 00:00:00,2024-05-23 22:21:14,0,Unknown,toposcope here  #OsmAnd,2,0,Crsi,Fixed.
4075141,Ísland,65.2575000,-21.1059500,2024-01-18 00:00:00,2024-05-23 22:15:40,0,Tajtrdlik,"Forwarding anonymous report from #Mapy.cz user, please verify: 'There is located hor spring'.",2,0,Crsi,"This is correct. Thank you for your report, I have added the hot tub."
1916919,Ísland,64.7670370,-21.5529871,2019-09-08 00:00:00,2024-05-23 21:58:28,0,mxmehl,"doesn't exist anymore, seems to be under construction",2,0,Crsi,I have marked the shop as disued after surveying as well. Thank you for your report.
3863473,Ísland,64.9658016,-21.0644853,2023-08-31 00:00:00,2024-05-23 21:55:17,0,RandomUser99,Tue road looks abandoned and there is ruined bridge. Not passable.  via StreetComplete 53.3,2,0,Crsi,Resolved. I have removed the track. Thank you for your report.
3307601,Ísland,64.6255646,-21.8008232,2022-08-10 00:00:00,2024-05-23 21:44:53,0,Unknown,Turn left,2,0,Crsi,"Closing this note as not helpful due to lack of information. Please provide some more information or further details by re-opening this note, or create a new one. Thank you."
4255566,Ísland,66.0683893,-23.1261796,2024-05-20 00:00:00,2024-05-23 20:17:46,0,Crsi,Convert to parking area  via StreetComplete 57.4,2,0,Crsi,Completed
2942577,Ísland,65.5250455,-22.4125224,2021-11-20 00:00:00,2024-05-23 00:15:05,0,Rainero,Hvaða salerni eru í réttri stöðu? Which of the toilets are at the correct position?,3,0,Crsi,Closing as completed.
3369935,Ísland,65.6394004,-21.5673718,2022-09-23 00:00:00,2024-05-21 11:38:11,0,Pan Perníček,"Forwarding anonymous report from #Mapy.cz user, please verify: There are no toilets.  https://www.openstreetmap.org/node/6658160185",3,0,WebFreak,
3705576,Ísland,66.0689939,-23.1202811,2023-05-25 00:00:00,2024-05-20 08:57:01,0,mpolitze,"'wrong address. likely moved to 66.068364, -23.123844' OSM snapshot date: 2023-05-03T17:52:15Z POI has no name POI types: amenity-biergarten internet_access-wlan  #organicmaps",2,0,Crsi,Duplicate
4253248,Ísland,64.0418594,-20.8852346,2024-05-19 00:00:00,2024-05-19 00:25:41,0,Unknown,start of stairs west  #OsmAnd,2,0,Crsi,Resolved.
4253249,Ísland,64.0418388,-20.8846822,2024-05-19 00:00:00,2024-05-19 00:25:41,0,Unknown,split stairs here. lower has 108  #OsmAnd,2,0,Crsi,Resolved.
4253250,Ísland,64.0417951,-20.8846918,2024-05-19 00:00:00,2024-05-19 00:21:21,0,Unknown,viewpoint  #OsmAnd,2,0,Crsi,Added.
3305883,Ísland,64.2165853,-20.7343286,2022-08-08 00:00:00,2024-05-19 00:08:09,0,Unknown,disused (closed forever),2,0,Crsi,Marked as disused.
3305882,Ísland,64.2156379,-20.7314157,2022-08-08 00:00:00,2024-05-18 23:54:22,0,Unknown,closed on mondays,2,0,Crsi,Closing as resolved.
3887581,Ísland,63.7712518,-18.1717589,2023-09-13 00:00:00,2024-05-16 21:06:23,0,Cody Swanson,Unable to answer 'Do you have to pay to use this restroom?' for https://osm.org/node/9890457318 via StreetComplete 53.3:  Closed,2,0,R3gi,"Updated. It should be open in the summer, but it seems it is not exact when it starts and ends. Thanks."
4118566,Ísland,63.7711507,-18.1714519,2024-02-18 00:00:00,2024-05-16 21:05:07,0,Unknown,"Parking is notfree anymore , app or access to parka.is is necessary to obtain parking ticket, WC closed in winter",2,0,R3gi,"Updated, thanks."
4111396,Ísland,63.7711200,-18.1714700,2024-02-13 00:00:00,2024-05-16 21:03:51,0,Tajtrdlik,"Forwarding anonymous report from #Mapy.cz user, please verify: 'This parking is paid. Fee is 1000 ISK per day'.  https://www.openstreetmap.org/way/638304546",2,0,R3gi,"Updated, thanks."
4138097,Ísland,64.3206000,-22.0699900,2024-03-03 00:00:00,2024-05-15 19:40:54,0,UlfIS,Café Kaja does not exist anymore,2,0,Crsi,I've marked the café as disused. What is there now? I'm closing this note as resolved.
4174847,Ísland,64.1284000,-21.9399000,2024-03-30 00:00:00,2024-05-14 23:21:31,0,axelbr49anaga,Aeroport,3,0,Crsi,I will now close this issue due to lack of activity and meaningful conversation. Feel free to re-open if you want to address the issue.
4245031,Ísland,64.1458800,-21.8475300,2024-05-14 00:00:00,2024-05-14 20:16:10,0,Unknown,"Revisit and record disc golf course here, if it still exists. Create GPS tracks of holes. Ref Node 7821366785.",4,0,Crsi,Updated.
4210386,Ísland,64.1221244,-21.8754608,2024-04-22 00:00:00,2024-05-14 15:09:14,0,Crsi,Nail studio Adora Neglur 8:30-16:30 555-0908  via StreetComplete 57.1,2,0,Crsi,Closing as completed.
4210384,Ísland,64.1220717,-21.8754115,2024-04-22 00:00:00,2024-05-14 15:01:58,0,Crsi,Grímur Hótel Level 2  via StreetComplete 57.1,2,0,Crsi,Resolved already.
4210388,Ísland,64.1221770,-21.8753995,2024-04-22 00:00:00,2024-05-14 15:00:08,0,Crsi,"Ice cream shop Isbúð Vesturbæjar Alla daga 12:00-23:30 Inside only, wheelchair=yes  via StreetComplete 57.1",2,0,Crsi,Closing as resolved.
4210382,Ísland,64.1220641,-21.8754503,2024-04-22 00:00:00,2024-05-14 14:57:30,0,Crsi,Hik & Rós Jewelry  Level 0 No opening hours  via StreetComplete 57.1,2,0,Crsi,Closing as resolved.
3331839,Ísland,64.1116146,-21.8546156,2022-08-25 00:00:00,2024-05-14 14:55:35,0,Anton Vilhelm Ásgeirsson,"Unable to answer 'Who is allowed to use this playground?' for https://osm.org/way/166274034 via StreetComplete 45.2:  Þetta er ekki leikvöllur, bara grasblettur.",2,0,Crsi,Leyst. Takk fyrir skýrsluna.
4235867,Ísland,64.2552894,-14.9930161,2024-05-08 00:00:00,2024-05-13 18:04:49,0,Unknown,'Navigation not possible beyond this point. ' OSM snapshot date: 2024-03-26T20:04:01Z POI has no name POI types: barrier-chain  #organicmaps ios,2,0,R3gi,"The chain barrier and private road is already mapped. The app should not navigate to that road. If it does, it needs to be reported and fixed by the app developer. OSM data seem to be okay."
3684115,Ísland,64.2606123,-14.9852926,2023-05-11 00:00:00,2024-05-13 18:01:37,0,Matyjace,"Forwarding anonymous report from #Mapy.cz user, please verify: 'Viking Village Prop For Movie',",2,0,R3gi,"Correct, it's an abandoned movie set. Added czech translation of the area description."
3885574,Ísland,64.1416515,-21.8912475,2023-09-12 00:00:00,2024-05-10 12:31:54,0,Unknown,There should be a music school here,2,0,Crsi,Added. Closing as resolved.
3202569,Ísland,64.9141001,-23.8881183,2022-05-30 00:00:00,2024-05-09 23:06:40,0,overflorian,A new building is almost delivered. Maybe a new museum?,2,0,R3gi,Building is complete. It's a restaurant.
2362345,Ísland,65.4990640,-19.3794686,2020-09-25 00:00:00,2024-05-08 17:36:08,0,Daniel Viera,"'no table' The place has gone or never existed. This is an auto-generated note from MAPS.ME application: a user reports a POI that is visible on a map (which can be outdated), but cannot be found on the ground. POI has no name POI types: highway-rest_area OSM data version: 2020-08-03T21:05:25Z  #mapsme",2,0,R3gi,"Updated, based on physical survey. Thanks."
1322229,Ísland,65.4990643,-19.3794672,2018-03-09 00:00:00,2024-05-08 17:34:51,0,mpsupertramp,'Reykjafoss Parking' POI has no name POI types: highway-rest_area OSM data version: 2018-01-26T12:04:02Z  #mapsme,3,0,R3gi,I have updated the area. Parking is next to the building now.
2839043,Ísland,64.0059841,-16.9281636,2021-09-06 00:00:00,2024-05-04 17:31:10,0,intgr,Road is blocked by large rocks,2,0,R3gi,It's already mapped. Thanks!
4067941,Ísland,64.1303401,-21.7619318,2024-01-14 00:00:00,2024-05-03 11:31:59,0,Hth249,Unable to answer 'Is there a shelter at this stop?' for https://osm.org/node/1619586938 via StreetComplete 56.0:  This isn't a bus stop anymore,2,0,robertbeck,
4127803,Ísland,63.5321487,-19.5112890,2024-02-25 00:00:00,2024-05-01 21:12:29,0,Ceba05,'Skogafoss' POI name: Skogafoss POI types: waterway-waterfall OSM data version: 2023-11-20T18:06:08Z  #mapsme,2,0,R3gi,The waterfall is already marked in the map. The duplicated node was removed. Thanks for the comment.
3879272,Ísland,64.2592645,-20.2251810,2023-09-09 00:00:00,2024-04-30 12:43:29,0,naught101,viewpoint in river?!,2,0,R3gi,Moved to correct place. Thanks.
2801849,Ísland,64.1355833,-21.9561017,2021-08-13 00:00:00,2024-04-29 14:10:23,0,Unknown,according to straeto.is here is as bus stop skerjagarðar,3,0,Crsi,Closing as already completed
4221199,Ísland,64.1353746,-21.9567890,2024-04-29 00:00:00,2024-04-29 14:10:23,0,Crsi,Bus stop 2  via StreetComplete 57.1,2,0,Crsi,Obsolete since already mapped
4221198,Ísland,64.1354401,-21.9512668,2024-04-29 00:00:00,2024-04-29 14:10:23,0,Crsi,Parcel locker as well  via StreetComplete 57.1,2,0,Crsi,Resolved through recent change
4215182,Ísland,64.1454144,-21.9335864,2024-04-26 00:00:00,2024-04-29 14:04:18,0,Crsi,Packing station & postbox  via StreetComplete 57.1,3,0,Crsi,Only a parcel locker. Closing as resolved.
4023488,Ísland,64.1396400,-21.8955700,2023-12-11 00:00:00,2024-04-29 13:59:19,0,Unknown,"Gáski sjúkraþjálfun, physical therapist",2,0,Crsi,Resolved through recent changeset
3891221,Ísland,63.5445000,-19.6094000,2023-09-16 00:00:00,2024-04-28 16:37:17,0,Unknown,1,3,0,sheikchilli,unclear/spam/personal note
4210380,Ísland,64.1228921,-21.8787730,2024-04-22 00:00:00,2024-04-27 23:59:59,0,Crsi,One way  via StreetComplete 57.1,2,0,Crsi,Resolved
4210387,Ísland,64.1219867,-21.8752339,2024-04-22 00:00:00,2024-04-27 23:32:01,0,Crsi,Post box for pick-up  via StreetComplete 57.1,2,0,Crsi,Resolved by recent change
4210381,Ísland,64.1230138,-21.8795015,2024-04-22 00:00:00,2024-04-27 23:13:54,0,Crsi,Turning circle probably here  via StreetComplete 57.1,2,0,Crsi,Resolved
4210389,Ísland,64.1226602,-21.8760026,2024-04-22 00:00:00,2024-04-27 15:05:22,0,Crsi,"Stairs, no footway  via StreetComplete 57.1",2,0,Crsi,Resolved
211602,Ísland,64.3737871,-21.5638393,2014-08-03 00:00:00,2024-04-27 12:23:08,0,Unknown,Does this hot pool still exist? See also Nr. 211601.,3,0,R3gi,The place was rebuild to Hvammsvík Hot Springs. Details updated.
3246305,Ísland,64.3737767,-21.5638044,2022-06-30 00:00:00,2024-04-27 12:22:45,0,Pan Perníček,"Forwarding anonymous report from #Mapy.cz user, please verify: Hvalfjarðarlaug is closed.  https://www.openstreetmap.org/way/391588543",2,0,R3gi,The place was rebuild to Hvammsvík Hot Springs. Details updated.
1207087,Ísland,64.3737651,-21.5638661,2017-11-15 00:00:00,2024-04-27 12:22:36,0,pyrenours,private property!!! closed,2,0,R3gi,The place was rebuild to Hvammsvík Hot Springs. Details updated.
1515944,Ísland,64.3737578,-21.5638596,2018-09-05 00:00:00,2024-04-27 12:22:29,0,Shiruban,"'Road is closed (not allowed for pedestrians or cars). visitors seem to be not welcomed anymore ' The place has gone or never existed. This is an auto-generated note from MAPS.ME application: a user reports a POI that is visible on a map (which can be outdated), but cannot be found on the ground. POI name: hot pool POI types: tourism-attraction leisure-swimming_pool OSM data version: 2017-07-28T09:42:02Z  #mapsme",2,0,R3gi,The place was rebuild to Hvammsvík Hot Springs. Details updated.
1952806,Ísland,64.1439427,-21.9239572,2019-10-07 00:00:00,2024-04-26 18:14:27,0,kupojsin,Unable to answer 'What kind of parking is this?' for https://osm.org/way/121161902 via StreetComplete 14.1:  street parking,3,0,Crsi,
2276147,Ísland,67.1505757,-18.6832058,2020-07-23 00:00:00,2024-04-24 21:09:32,0,THWBM,According to Wikipedia this island should be smaler than the otlines that are maped. The arial image is very low resolution so I do not know how to map it correctly. https://en.wikipedia.org/wiki/Kolbeinsey,2,0,Taktaal,i shrank the island according to wikipedia sources
3953797,Ísland,64.1403160,-21.8937445,2023-10-23 00:00:00,2024-04-20 23:53:45,0,Crsi,Red light check in all 4 directions  via StreetComplete 54.1,2,0,Crsi,Closed through recent changeset
4053999,Ísland,64.1755483,-20.4510498,2024-01-05 00:00:00,2024-04-17 19:54:16,0,Matyjace,"Forwarding anonymous report from #mapycz user, please verify: 'closed'",2,0,R3gi,Details updated.
3514606,Ísland,64.1400981,-21.9016397,2023-01-12 00:00:00,2024-04-08 00:42:35,0,Unknown,"onosm.org submitted note from a business: name: Sveinsbakarí - Reykjavík Bakarí ehf. phone: 5620677 website:  twitter:  facebook:  email: reykjavikbakari@reykjavikbakari.is hours: Mon - Fri 7:30AM-5:00PM, Sat 8:10AM-4:00PM category:  address: Skipholt 50b",2,0,Crsi,Closing as resolved. Thank you for your report.
3956423,Ísland,64.1379439,-21.9007415,2023-10-24 00:00:00,2024-04-08 00:39:15,0,Crsi,New  via StreetComplete 54.1  Attached photo(s): https://westnordost.de/p/182969.jpg https://westnordost.de/p/182970.jpg https://westnordost.de/p/182971.jpg https://westnordost.de/p/182972.jpg,2,0,Crsi,Closing as already completed.
3956417,Ísland,64.1375839,-21.9031904,2023-10-24 00:00:00,2024-04-08 00:37:21,0,Crsi,Stairs  via StreetComplete 54.1  Attached photo(s): https://westnordost.de/p/182967.jpg,2,0,Crsi,Added through recent changeset.
3962498,Ísland,64.1362900,-21.9020900,2023-10-29 00:00:00,2024-04-08 00:22:40,0,Crsi,"Area most likely already completely build, no construction area",2,0,Crsi,Apartments completed. Closing.
1008286,Ísland,64.1167758,-21.8898779,2017-05-26 00:00:00,2024-04-02 21:02:20,0,Stalfur,Raða heimilisföngum á rétt hús,2,0,Crsi,This seems to be resolved already.
4176582,Ísland,64.1219870,-21.8966140,2024-03-31 00:00:00,2024-04-02 21:00:18,0,Crsi,New building under construction  via StreetComplete 57.1,2,0,Crsi,Resolved
4176584,Ísland,64.1204962,-21.8919522,2024-03-31 00:00:00,2024-04-02 20:56:18,0,Crsi,Unable to answer 'Does this bench have a backrest?' – Bench – https://osm.org/node/2018349788 via StreetComplete 57.1:  Demolished,2,0,Crsi,Resolved
2476662,Ísland,64.1406450,-21.9010850,2020-12-29 00:00:00,2024-04-02 20:29:09,0,maggisam,This is Brautarholt 29,2,0,Crsi,This has already been Brautarholt 29. Closing this note as already completed.
4171681,Ísland,64.1410360,-21.9048386,2024-03-28 00:00:00,2024-04-02 20:24:40,0,hvithoefdi,Unable to answer 'What are the opening hours here?' – Tískan (Clothing Store) – https://osm.org/node/4892325614 via StreetComplete 57.1:  Lucky Beans,2,0,Crsi,Thank you for your survey. I have changed the name and type to the new store.
3152169,Ísland,64.1411945,-21.9054401,2022-04-25 00:00:00,2024-04-02 20:22:05,0,Unknown,"Bókasamlagið, kaffihús https://bokasamlagid.is/",2,0,Crsi,The place has been added. Thank you for the notice.
4093720,Ísland,64.1445308,-21.7926210,2024-01-30 00:00:00,2024-04-02 11:35:32,0,indianfoodbox,Indian Food Box Restaurant,2,0,Kerploonk,
4166760,Ísland,64.1370132,-21.9226843,2024-03-25 00:00:00,2024-03-31 17:04:41,0,hvithoefdi,Unable to answer 'How many steps are here?' – Steps – https://osm.org/way/383317334 via StreetComplete 57.1:  no stairs,3,0,Crsi,Added the step_count. Closing as completed.
2653833,Ísland,64.1209357,-21.8939029,2021-05-04 00:00:00,2024-03-30 23:40:12,0,QtsokWzldP,Unable to answer 'Is this still here? (Bench)' for https://osm.org/node/2018349792 via StreetComplete 31.3:  the bench has moved.  Attached photo(s): https://westnordost.de/p/40079.jpg,2,0,Crsi,"I moved the bench accordingly, thank you for your report."
4149496,Ísland,64.1059200,-21.8421500,2024-03-11 00:00:00,2024-03-27 14:28:06,0,Kerploonk,40 km/klst,2,0,Kerploonk,
4149500,Ísland,64.1014000,-21.8306000,2024-03-11 00:00:00,2024-03-27 14:28:03,0,Kerploonk,40 km/klst,2,0,Kerploonk,
4149499,Ísland,64.0990700,-21.8268200,2024-03-11 00:00:00,2024-03-27 14:28:01,0,Kerploonk,40 km/klst,2,0,Kerploonk,
4149498,Ísland,64.0986400,-21.8274000,2024-03-11 00:00:00,2024-03-27 14:27:59,0,Kerploonk,40 km/klst,2,0,Kerploonk,
1309799,Ísland,64.3832871,-21.8494489,2018-02-24 00:00:00,2024-03-25 13:01:19,0,Guðmundur Pétursson,'Speed cam 90km/h' POI has no name POI types: man_made-surveillance OSM data version: 2018-01-26T12:04:02Z  #mapsme,3,0,Crsi,This speed camera has been added. Closing as already resolved. Please re-open if you feel something is missing.
3294903,Ísland,63.5444933,-19.6340712,2022-08-02 00:00:00,2024-03-23 15:37:54,0,sunnivaløvstad,I accidentally marked these addresses as F__ when it should be 4__.  via StreetComplete 44.1,2,0,Crsi,I've corrected the house numbers. Thank you for your contributions.
1870631,Ísland,63.4810891,-19.3135397,2019-08-05 00:00:00,2024-03-23 15:29:13,0,sgtbrobee,House missing here  via StreetComplete 12.2,2,0,Crsi,There's no visible missing house on aerial imagery and Staðfangaskrá doesn't contain it either. Closing this as outdated.
3113916,Ísland,63.4041000,-19.0567000,2022-03-31 00:00:00,2024-03-23 15:19:52,0,Unknown,spiaggia nera,2,0,Crsi,This is a black beach but not the only one. The official name is Reynisfjara. Closing.
1916048,Ísland,64.2529127,-14.9902505,2019-09-07 00:00:00,2024-03-23 13:05:01,0,loukote,Missing track and parking further on.,2,0,Adrien Ri,not an issue anymore
1861365,Ísland,64.2595793,-15.2163587,2019-07-28 00:00:00,2024-03-23 13:04:16,0,sgtbrobee,Wind hose,2,0,Adrien Ri,added
4161715,Ísland,63.8815000,-22.3841000,2024-03-21 00:00:00,2024-03-21 20:12:17,0,kuhni74,commons: Category:Sundhnúkagígaröðin,2,0,kuhni74,
4160382,Ísland,63.4656000,-20.1764000,2024-03-20 00:00:00,2024-03-21 20:10:43,0,kuhni74,p.114m,6,1,kuhni74,
4023627,Ísland,63.8883443,-22.2711325,2023-12-11 00:00:00,2024-03-21 10:42:45,0,Unknown,Fagradalsfjall,2,0,kuhni74,see https://www.openstreetmap.org/note/2588325
4160377,Ísland,63.3304000,-20.3978000,2024-03-20 00:00:00,2024-03-20 11:42:29,0,kuhni74,p.180m,3,0,kuhni74,
4160379,Ísland,63.3353000,-20.4001000,2024-03-20 00:00:00,2024-03-20 11:40:56,0,kuhni74,p.86m,2,0,kuhni74,
4160376,Ísland,63.3621000,-20.3615000,2024-03-20 00:00:00,2024-03-20 11:38:33,0,kuhni74,p.122m,2,0,kuhni74,
4160372,Ísland,63.3910000,-20.3652000,2024-03-20 00:00:00,2024-03-20 11:37:21,0,kuhni74,p.90m,2,0,kuhni74,
