note_id,country_name,latitude,longitude,opened_at,closed_at,days_to_resolution,opened_by_username,opening_comment,total_comments,was_reopened,closed_by_username,closing_comment
1255801,Ísland,64.1208132,-21.8463204,2018-01-02 00:00:00,2020-11-26 02:52:03,0,Katya Savenkova,'Водопад ' POI has no name POI types: psurface-paved_good highway-footway OSM data version: 2017-09-17T07:13:02Z  #mapsme,2,0,Jarek 🚲,
2132065,Ísland,64.1332804,-21.8756998,2020-03-26 00:00:00,2020-11-26 02:51:44,0,Unknown,Hér erum við,2,0,Jarek 🚲,
1762171,Ísland,64.1426596,-21.9393218,2019-04-30 00:00:00,2020-11-26 02:50:31,0,Unknown,Office of the President of Iceland,2,0,Jarek 🚲,https://www.openstreetmap.org/node/6568834385/history
2103756,Ísland,64.1420000,-21.9480000,2020-02-27 00:00:00,2020-11-26 02:49:10,0,Iceland Highlights,Þjóðminnjasafn Íslands,2,0,Jarek 🚲,you can use this link to link to it: https://www.openstreetmap.org/relation/6180675
1693021,Ísland,64.1556619,-21.9503403,2019-02-26 00:00:00,2020-11-26 02:48:07,0,Arkaroo,Unable to answer 'What are the opening hours of Byko/Elko?' for https://osm.org/node/1128700919 via StreetComplete 10.1:  byko and elko are different stores now,2,0,Jarek 🚲,mapped as separate nodes now
2017167,Ísland,64.1524656,-21.9468645,2019-12-05 00:00:00,2020-11-26 02:47:44,0,Arkaroo,"Unable to answer 'What are the opening hours of Fish and Chips Vagninn?' for https://osm.org/node/3705814512 via StreetComplete 15.0:  closed during winter, hours sometimes different each season",2,0,Jarek 🚲,
1835452,Ísland,64.1459808,-21.9422361,2019-07-05 00:00:00,2020-11-26 02:47:10,0,AndrDobr,'10.6. заселение и 11.01 поход по городу' POI name: Reykjavík POI types: place-city-capital-2 OSM data version: 2019-05-17T13:54:02Z  #mapsme,2,0,Jarek 🚲,
1084748,Ísland,64.1487253,-21.9397455,2017-07-30 00:00:00,2020-11-26 02:46:57,0,Efre Sergio Gallini,'AUTO' POI name: Tryggvagata POI types: highway-residential OSM data version: 2017-07-03T17:28:05Z  #mapsme,3,0,Jarek 🚲,access=public will be picked up by some validator probably - resolving to avoid having note open forever
1979136,Ísland,64.1482385,-21.9350249,2019-10-30 00:00:00,2020-11-26 02:46:30,0,Unknown,"onosm.org submitted note from a business: name: Fréttablaðið phone: 5505000 website: www.frettabladid.is twitter: undefined hours:  category: ,Newspapers & Magazines address: kalkofnsvegur 2",2,0,Jarek 🚲,
906636,Ísland,64.1466113,-21.8798480,2017-02-26 00:00:00,2020-11-26 02:44:54,0,Magdalena Kochan,basen heater ma (OSM data version: 2016-12-14T16:41:03Z) #mapsme,4,0,Jarek 🚲,"no response, resolving. please reopen if needed"
650175,Ísland,64.1460122,-21.8746516,2016-07-30 00:00:00,2020-11-26 02:44:24,0,Kjarrval,Tent area of the hostel.,6,0,Jarek 🚲,"no response, resolving. please reopen if needed"
1827754,Ísland,63.9934358,-22.5498301,2019-06-28 00:00:00,2020-11-26 02:42:50,0,Unknown,"Parking space is available here, visible from satellite.",2,0,Jarek 🚲,now mapped
1827755,Ísland,63.9934100,-22.5511551,2019-06-28 00:00:00,2020-11-26 02:42:47,0,Unknown,"Parking space is available here, visible from satellite.",2,0,Jarek 🚲,now mapped
924754,Ísland,63.8562256,-21.9932960,2017-03-12 00:00:00,2020-11-26 02:40:59,0,Gabriel Andres Quiroga Monrroy,Cráter (OSM data version: 2017-02-15T16:20:03Z) #mapsme,2,0,Jarek 🚲,
1600461,Ísland,63.9100925,-21.0175914,2018-11-25 00:00:00,2020-11-26 02:39:06,0,Unknown,Skóatún 801 Selfoss,2,0,Jarek 🚲,https://www.openstreetmap.org/way/452908092
1820962,Ísland,63.9654261,-21.0987069,2019-06-21 00:00:00,2020-11-26 02:38:46,0,LBT2019,'20171013晚9:30观极光，大面积爆发梦幻而多彩' POI has no name POI types: landuse-farmland OSM data version: 2017-09-17T07:13:02Z  #mapsme,2,0,Jarek 🚲,
1841167,Ísland,64.3258896,-20.2859591,2019-07-11 00:00:00,2020-11-26 02:37:26,0,Daniel Viera,'Picnic several tables' POI has no name POI types: tourism-picnic_site OSM data version: 2018-07-05T18:22:02Z  #mapsme,2,0,Jarek 🚲,
1915761,Ísland,64.3267846,-20.2868128,2019-09-07 00:00:00,2020-11-26 02:37:21,0,loukote,Marteinslaug is not bath able - temperature around 80°C.,2,0,Jarek 🚲,https://www.openstreetmap.org/node/3021833350/history is mapped as spring not bath
1264358,Ísland,65.7741502,-21.5389109,2018-01-10 00:00:00,2020-11-26 02:35:17,0,Ben97,There should be a bridge at this point. Could anyone confirm this and edit it?,2,0,Jarek 🚲,bridge now present
1873193,Ísland,65.8493943,-22.4136158,2019-08-07 00:00:00,2020-11-26 02:34:33,0,moreiravn,'It is a picnic area with a table just in front of the lake with a beautiful view. There is place for about two cars' POI has no name POI types: tourism-picnic_site OSM data version: 2019-06-21T10:47:15Z  #mapsme,2,0,Jarek 🚲,
1843204,Ísland,66.0383253,-22.9861385,2019-07-13 00:00:00,2020-11-26 02:33:42,0,fnxf,"'closed permanently until 2020' The place has gone or never existed. This is an auto-generated note from MAPS.ME application: a user reports a POI that is visible on a map (which can be outdated), but cannot be found on the ground. POI name: Amma Habbý POI types: amenity-restaurant OSM data version: 2019-06-21T10:47:15Z  #mapsme",2,0,Jarek 🚲,so... not permanently then?
1463393,Ísland,66.0665200,-23.1248400,2018-07-22 00:00:00,2020-11-26 02:32:41,0,Unknown,dauerhaft geschlossen,2,0,Jarek 🚲,see https://www.openstreetmap.org/note/1845890 presumably
1854079,Ísland,65.6857071,-23.5994578,2019-07-23 00:00:00,2020-11-26 02:30:29,0,Unknown,"'The museum has another place.' The place has gone or never existed. This is an auto-generated note from MAPS.ME application: a user reports a POI that is visible on a map (which can be outdated), but cannot be found on the ground. POI has no name POI types: tourism-museum OSM data version: 2019-06-21T10:47:15Z  #mapsme",2,0,Jarek 🚲,no museum found under the marker anymore
2271209,Ísland,65.6722316,-23.6244357,2020-07-19 00:00:00,2020-11-26 02:30:00,0,Unknown,onosm.org submitted note from a business: name: Lás ehf phone:  website:  twitter: undefined hours:  category:  address: Járnhóll,2,0,Jarek 🚲,duplicate of https://www.openstreetmap.org/note/2270209
2269362,Ísland,65.4774011,-23.9971629,2020-07-17 00:00:00,2020-11-26 02:28:52,0,Amenofiiv,Franska Kaffihúsið is permanently closed  via StreetComplete 21.1,2,0,Jarek 🚲,https://www.openstreetmap.org/way/536593312/history since updated
1400867,Ísland,65.3822633,-21.8767634,2018-05-21 00:00:00,2020-11-26 02:25:00,0,HY Rieko Poppy,"'There is no fuel station. ' The place has gone or never existed. This is an auto-generated note from MAPS.ME application: a user reports a POI that is visible on a map (which can be outdated), but cannot be found on the ground. POI has no name POI types: amenity-fuel OSM data version: 2017-05-11T13:22:09Z  #mapsme",2,0,Jarek 🚲,https://www.openstreetmap.org/node/2935922186 since updated/corrected
596480,Ísland,65.4197479,-21.7466247,2016-06-16 00:00:00,2020-11-26 02:24:15,0,Einar Bergmundur,Gamla skólahúsið (OSM data version: 2016-06-01T10:03:02Z) #mapsme,2,0,Jarek 🚲,https://www.openstreetmap.org/node/4248296797/history indeed
1400864,Ísland,65.3961009,-20.9416354,2018-05-21 00:00:00,2020-11-26 02:23:25,0,HY Rieko Poppy,"'The bakery is no longer there.' The place has gone or never existed. This is an auto-generated note from MAPS.ME application: a user reports a POI that is visible on a map (which can be outdated), but cannot be found on the ground. POI name: Brauð og kökugerðin POI types: shop-bakery OSM data version: 2017-05-11T13:22:09Z  #mapsme",3,0,Jarek 🚲,bakery no longer found under marker. might have been better off tagged as craft=bakery or something rather than shop...
686546,Ísland,65.3996582,-20.9415436,2016-08-24 00:00:00,2020-11-26 02:22:37,0,z3ntu,street name is Kirksjuhvammur,3,0,Jarek 🚲,https://www.openstreetmap.org/way/48322198 now has name
1921262,Ísland,66.0553894,-17.3515110,2019-09-11 00:00:00,2020-11-26 02:21:34,0,loukote,This bath is private with no public access and should be marked as such.,3,0,Jarek 🚲,https://www.openstreetmap.org/way/724634429 indeed marked as private as is the parking https://www.openstreetmap.org/node/613888175
1672664,Ísland,65.2888396,-20.9877491,2019-02-05 00:00:00,2020-11-26 02:18:31,0,Unknown,"this mountain is not in the right scale, or do not exist.",3,0,Jarek 🚲,
1499475,Ísland,65.2090543,-21.0951126,2018-08-23 00:00:00,2020-11-26 02:18:23,0,Unknown,"onosm.org submitted note from a business: Name: Riishús Phone:  Website:  Twitter: undefined Hours: 13pm-17pm Category: ,Coffee & Tea,Breakfast & Brunch Address:",2,0,Jarek 🚲,duplicate of https://www.openstreetmap.org/note/1496028
1523114,Ísland,66.0459646,-17.3439294,2018-09-11 00:00:00,2020-11-26 02:16:26,0,Ökokirsche,"'No toilet here' The place has gone or never existed. This is an auto-generated note from MAPS.ME application: a user reports a POI that is visible on a map (which can be outdated), but cannot be found on the ground. POI has no name POI types: amenity-toilets OSM data version: 2018-08-04T14:22:01Z  #mapsme",2,0,Jarek 🚲,since removed
1513531,Ísland,66.0393855,-17.3429489,2018-09-03 00:00:00,2020-11-26 02:16:09,0,andre_muerner,is now a nettó,2,0,Jarek 🚲,since updated
2308952,Ísland,65.5860933,-16.8940344,2020-08-15 00:00:00,2020-11-26 02:15:22,0,Juan Antonio de la Casa Rincn,'Campo de lava' POI name: Dimmuborgir POI types: leisure-nature_reserve OSM data version: 2020-07-14T11:22:37Z  #mapsme,2,0,Jarek 🚲,
2320063,Ísland,65.6262900,-16.8826900,2020-08-24 00:00:00,2020-11-26 02:15:15,0,Unknown,Grjótagjá +  Parking,2,0,Jarek 🚲,
2322202,Ísland,65.6261850,-16.8826282,2020-08-25 00:00:00,2020-11-26 02:15:11,0,Unknown,GRJÓTAGJÁ,2,0,Jarek 🚲,
1865022,Ísland,65.8126482,-18.0435893,2019-07-31 00:00:00,2020-11-26 02:14:28,0,mfbehrens,displayed as 1 1 is going through a new tunnel,2,0,Jarek 🚲,seems to since have been updated
903210,Ísland,65.6912607,-18.0543995,2017-02-23 00:00:00,2020-11-26 02:13:17,0,spirou,new forest geometry. street are corrected.,2,0,Jarek 🚲,"would since have changed, lots of edits with the new tunnel being open"
1835431,Ísland,65.7296379,-17.9175065,2019-07-05 00:00:00,2020-11-26 02:12:40,0,AndrDobr,'тонель' POI name: Norðurlandsvegur POI types: psurface-paved_good highway-trunk OSM data version: 2019-05-17T13:54:02Z  #mapsme,2,0,Jarek 🚲,
1919171,Ísland,65.0304412,-16.7468870,2019-09-09 00:00:00,2020-11-26 02:11:50,0,loukote,Correct name of the lake is 'Öskjuvatn'. 'Askja' being the name of the volcano/mountain.,2,0,Jarek 🚲,lake is https://www.openstreetmap.org/relation/193150 with correct name; volcano is https://www.openstreetmap.org/node/308855341 with correct name
1949309,Ísland,65.0056052,-15.7601413,2019-10-05 00:00:00,2020-11-26 02:10:46,0,Dante1604,"'Pool,  Waterfall,  hot thermal water,  only to reach with a good 4wd' POI name: Laugarvallalaug POI types: amenity natural-water OSM data version: 2019-08-30T18:41:13Z  #mapsme",2,0,Jarek 🚲,
2306547,Ísland,65.3861482,-14.6578217,2020-08-13 00:00:00,2020-11-26 02:08:00,0,Unknown,Stuff,2,0,Jarek 🚲,
946162,Ísland,65.2616095,-14.3996203,2017-03-30 00:00:00,2020-11-26 02:07:32,0,newman16661,"The place has gone or never existed. This is an auto-generated note from MAPS.ME application: a user reports a POI that is visible on a map (which can be outdated), but cannot be found on the ground. User comments: 'they moved' (OSM data version: 2017-03-06T16:48:02Z) #mapsme",2,0,Jarek 🚲,nothing under the marker right now
1916925,Ísland,65.2607657,-14.3980980,2019-09-08 00:00:00,2020-11-26 02:07:14,0,loukote,"Orkan, not Shell.",2,0,Jarek 🚲,since updated
2080822,Ísland,65.2598451,-14.0048878,2020-02-06 00:00:00,2020-11-26 02:06:55,0,Nastlik,'Разноцветный город ' POI name: Seyðisfjörður POI types: place-town OSM data version: 2019-11-24T01:08:45Z  #mapsme,2,0,Jarek 🚲,
1772773,Ísland,65.2598451,-14.0048878,2019-05-09 00:00:00,2020-11-26 02:05:52,0,steve9188,'塞济斯菲厄泽 白日梦想家拍摄地' POI name: Seyðisfjörður POI types: place-town OSM data version: 2018-09-11T19:10:03Z  #mapsme,2,0,Jarek 🚲,
1916229,Ísland,64.6532697,-14.3420076,2019-09-07 00:00:00,2020-11-26 02:05:17,0,loukote,Incorrect POI. Correct should be 'hot spring'. It's a 4x1.3m stainless steel pool with 38°C water.,2,0,Jarek 🚲,https://www.openstreetmap.org/node/5058302723/history since updated
1429847,Ísland,64.6537435,-14.3152155,2018-06-18 00:00:00,2020-11-26 02:04:33,0,maurizioa,'area per discarica rifiuti' POI has no name POI types: amenity-waste_disposal OSM data version: 2018-05-12T22:49:02Z  #mapsme,2,0,Jarek 🚲,
1916306,Ísland,64.7888485,-14.4896622,2019-09-07 00:00:00,2020-11-26 02:04:24,0,loukote,Missing bridge.,2,0,Jarek 🚲,there is now a bridge
1972221,Ísland,63.8815816,-16.6457891,2019-10-24 00:00:00,2020-11-26 02:02:58,0,Unknown,"onosm.org submitted note from a business: name: Cafe Vatnajökull  phone: 4781682 website: https://cafevatnajokull.business.site/?utm_source=gmb&utm_medium=referral twitter: undefined hours: Monday-Saturday 10:00-16:30 category: ,Cafés,Cafes address: Fagurhólsmýri",2,0,Jarek 🚲,now mapped
1914302,Ísland,64.0059344,-16.8864981,2019-09-05 00:00:00,2020-11-26 02:02:32,0,loukote,Bridge on a footpath over a wet/dry overflow of the lagoon.,2,0,Jarek 🚲,now mapped accordingly
1952452,Ísland,64.0262000,-16.9631000,2019-10-07 00:00:00,2020-11-26 02:02:15,0,Runatora,The canyon name is Eystragil,2,0,Jarek 🚲,now mapped
1992249,Ísland,64.0270336,-16.9747501,2019-11-11 00:00:00,2020-11-26 02:02:09,0,mwoeosm,"'There is no place like this here, just a trail and trees' The place has gone or never existed. This is an auto-generated note from MAPS.ME application: a user reports a POI that is visible on a map (which can be outdated), but cannot be found on the ground. POI has no name POI types: shop-travel_agency OSM data version: 2019-07-27T07:02:33Z  #mapsme",2,0,Jarek 🚲,there's now a stone https://www.openstreetmap.org/node/6758003346/history underneath the marker? at least it's not a travel agency though
1896186,Ísland,64.0261032,-16.9734198,2019-08-22 00:00:00,2020-11-26 02:01:04,0,Davidmenhur,"'Nothing in the path' The place has gone or never existed. This is an auto-generated note from MAPS.ME application: a user reports a POI that is visible on a map (which can be outdated), but cannot be found on the ground. POI has no name POI types: shop-travel_agency OSM data version: 2019-06-21T10:47:15Z  #mapsme",2,0,Jarek 🚲,since removed
1952445,Ísland,64.0156700,-16.9659800,2019-10-07 00:00:00,2020-11-26 02:00:40,0,Runatora,Why is this here? there is no company that operates from this point,2,0,Jarek 🚲,nothing found under marker anymore
1952464,Ísland,64.0137300,-16.9705400,2019-10-07 00:00:00,2020-11-26 01:58:45,0,Runatora,About here is where you access the visitors parking,2,0,Jarek 🚲,now mapped
1992556,Ísland,64.0144794,-16.9688721,2019-11-12 00:00:00,2020-11-26 01:58:37,0,Kardashvg,'Платная' POI has no name POI types: amenity-parking OSM data version: 2019-04-19T10:36:02Z  #mapsme,2,0,Jarek 🚲,https://www.openstreetmap.org/way/720033032 is indeed tagged as fee=yes
1820958,Ísland,64.0159948,-16.9659431,2019-06-21 00:00:00,2020-11-26 01:58:12,0,LBT2019,'20171011早9:30参加冰川徒步，2.5小时，又步行往返5公里看黑瀑布' POI has no name POI types: amenity-parking-fee OSM data version: 2017-09-17T07:13:02Z  #mapsme,2,0,Jarek 🚲,
1952479,Ísland,64.0166882,-16.9661638,2019-10-07 00:00:00,2020-11-26 01:57:55,0,Runatora,Here is also a cafeteria,2,0,Jarek 🚲,now mapped
1952432,Ísland,64.0168500,-16.9690200,2019-10-07 00:00:00,2020-11-26 01:57:45,0,Runatora,Grilling area,2,0,Jarek 🚲,now mapped
1952438,Ísland,64.0163100,-16.9680300,2019-10-07 00:00:00,2020-11-26 01:57:32,0,Runatora,the food truck Glacier goodies operates here,2,0,Jarek 🚲,now mapped
1952431,Ísland,64.0161000,-16.9713200,2019-10-07 00:00:00,2020-11-26 01:57:25,0,Runatora,Here are also showers and laundry room,2,0,Jarek 🚲,now mapped
1952420,Ísland,64.0168000,-16.9834100,2019-10-07 00:00:00,2020-11-26 01:57:04,0,Runatora,This Parking is permanently closed,2,0,Jarek 🚲,since removed
1952421,Ísland,64.0168700,-16.9842500,2019-10-07 00:00:00,2020-11-26 01:56:51,0,Runatora,This road is private,2,0,Jarek 🚲,https://www.openstreetmap.org/way/412809749 marked accordingly
1952467,Ísland,64.0175300,-16.9822000,2019-10-07 00:00:00,2020-11-26 01:56:28,0,Runatora,"This whole trail is not named Lambhagi, Lambhagi is a place which is exactly when I put down this note.",2,0,Jarek 🚲,path https://www.openstreetmap.org/way/171651028/history since updated
1952450,Ísland,64.0188000,-16.9806200,2019-10-07 00:00:00,2020-11-26 01:55:53,0,Runatora,This waterfall is named Þjófafoss NOT Þjóðafoss,2,0,Jarek 🚲,https://www.openstreetmap.org/node/1810528811/history since updated
902441,Ísland,63.7907557,-18.0464360,2017-02-22 00:00:00,2020-11-26 01:55:09,0,Unknown,There's no post office here. But there is a postal box by the Kjarval market,2,0,Jarek 🚲,looks like it has since been updated accordingly
973008,Ísland,63.4258927,-18.7548384,2017-04-22 00:00:00,2020-11-26 01:54:00,0,Bonny G-t,cliffs and viking tomb (OSM data version: 2016-06-20T05:57:02Z) #mapsme,2,0,Jarek 🚲,
937707,Ísland,63.4336531,-19.1738808,2017-03-23 00:00:00,2020-11-26 01:53:40,0,한상권,30일 숙소 (OSM data version: 2017-03-06T16:48:02Z) #mapsme,3,0,Jarek 🚲,"resolving due to inactivity, likely was a note to self from maps.me"
1971917,Ísland,63.4041093,-19.1165289,2019-10-23 00:00:00,2020-11-26 01:53:15,0,Helgsandrovna,'Проезд в заповедник до 25 июня с 9 утра и до 19 вечера.' POI name: Dyrhólaey POI types: leisure-nature_reserve OSM data version: 2019-04-19T10:36:02Z  #mapsme,2,0,Jarek 🚲,
2277835,Ísland,63.4154529,-19.0052736,2020-07-25 00:00:00,2020-11-26 01:53:06,0,GottfriedV,"'An dieser Stelle ist keine Bank (Geldinstitut). ' The place has gone or never existed. This is an auto-generated note from MAPS.ME application: a user reports a POI that is visible on a map (which can be outdated), but cannot be found on the ground. POI has no name POI types: amenity-bank OSM data version: 2020-06-07T12:42:57Z  #mapsme",2,0,Jarek 🚲,jetzt befindet sich hier in OSM keine Bank
2438166,Ísland,63.9379900,-21.0119700,2020-11-23 00:00:00,2020-11-23 15:37:34,0,Álfheiður Eymarsdóttir,"Selfossbæir, Austurbær",2,0,Álfheiður Eymarsdóttir,
2432784,Ísland,64.0604026,-21.9758320,2020-11-19 00:00:00,2020-11-19 20:40:47,0,Unknown,Ísblik ehf. https://www.facebook.com/isblik,2,0,lse93,
601383,Ísland,64.9127677,-15.2589994,2016-06-21 00:00:00,2020-10-28 18:40:59,0,Bastian Büscher,Handbetriebene Seilgondel über den Fluss  (OSM data version: 2016-06-01T10:03:02Z) #mapsme,2,0,Lars Gudmandsen,
2277174,Ísland,64.1382834,-21.8946479,2020-07-24 00:00:00,2020-09-28 14:54:57,0,Kjarrval,Those roads are not connected.,2,0,pallih,
2356240,Ísland,64.6591695,-18.8305349,2020-09-20 00:00:00,2020-09-20 16:48:41,0,Unknown,does the description for iceland read straight up just 'island' ._.,2,0,kartonage,Ísland is the official name in icelandic. Otherwise you will need to specify what description you mean and where exactly that is shown.
1827734,Ísland,63.9729693,-22.4886167,2019-06-28 00:00:00,2020-09-08 11:27:10,0,Unknown,Newly built house. Foundation can be traced within 6 months.,2,0,pallih,
1827744,Ísland,63.9707448,-22.4869001,2019-06-28 00:00:00,2020-09-08 11:27:01,0,Unknown,"Apartment complex built here, no plans on hand, satellite imaging will come within 6 months.",2,0,pallih,
1827743,Ísland,63.9707872,-22.4893892,2019-06-28 00:00:00,2020-09-08 11:26:59,0,Unknown,"Apartment complex built here, no plans on hand, satellite imaging will come within 6 months.",2,0,pallih,
1827742,Ísland,63.9708154,-22.4908268,2019-06-28 00:00:00,2020-09-08 11:26:57,0,Unknown,"Apartment complex built here, no plans on hand, satellite imaging will come within 6 months.",2,0,pallih,
1827748,Ísland,63.9712391,-22.4935305,2019-06-28 00:00:00,2020-09-08 11:26:53,0,Unknown,"Apartment complex built here, construction finished, satellite imaging will come within 6 months.",3,0,pallih,
1024225,Ísland,64.0729430,-22.6463053,2017-06-08 00:00:00,2020-09-08 11:25:02,0,Hrútur Teits,"'The steetname is wrong, the right name is Gerðavegur' POI name: Garðavegur POI types: highway-residential OSM data version: 2017-05-11T13:22:09Z  #mapsme",2,0,pallih,
2340008,Ísland,64.1083600,-21.8974000,2020-09-08 00:00:00,2020-09-08 11:12:24,0,Ragnheiður Gróa,Margrét systisr,4,1,Ragnheiður Gróa,Margrét systis
2086190,Ísland,63.9848468,-22.6263428,2020-02-11 00:00:00,2020-09-08 10:09:02,0,Lodgeyang,凯夫拉维克国际机场,4,1,pallih,
1827767,Ísland,63.9736543,-22.5894678,2019-06-28 00:00:00,2020-09-08 10:08:25,0,Unknown,"Building 10, previously a hospital. Demolished. Remove please.",2,0,pallih,
2339092,Ísland,66.0197000,-23.5558000,2020-09-07 00:00:00,2020-09-07 21:51:21,0,kari_hardarson,Valþjófsdalur valley,4,1,kari_hardarson,
2312515,Ísland,64.8508058,-20.5607188,2020-08-18 00:00:00,2020-09-07 08:36:17,0,michl84,new bridge,2,0,michl84,new bridge added and updated F578
2312542,Ísland,65.8244482,-16.3726377,2020-08-18 00:00:00,2020-08-19 22:23:50,0,takje,Missing road,2,0,takje,
2314009,Ísland,65.0870646,-14.8861815,2020-08-19 00:00:00,2020-08-19 22:22:37,0,takje,Not a path. The other one is.,2,0,takje,
2314022,Ísland,65.0898139,-14.8863507,2020-08-19 00:00:00,2020-08-19 22:22:03,0,takje,New boardwalk as of here to the viewpoint,2,0,takje,
2314477,Ísland,65.1636032,-15.3080273,2020-08-19 00:00:00,2020-08-19 22:19:21,0,takje,New stairs,2,0,takje,
576889,Ísland,64.3263928,-22.0661390,2016-05-29 00:00:00,2020-08-11 06:43:44,0,Jordi Vives,Toilets Hot water Shower Electricity Washing machine Dryer BBQ Hot tubs Swimming pool Supermarket (OSM data version: 2016-05-10T14:41:03Z) #mapsme,2,0,mfbehrens,
686549,Ísland,64.3264339,-22.0666623,2016-08-24 00:00:00,2020-08-11 06:41:56,0,z3ntu,Why are there two camping sites registered? I have also seen similar behavior with other campsites (2 entries).,3,0,mfbehrens,I see only one camp site
1599925,Ísland,64.3251300,-22.0779300,2018-11-25 00:00:00,2020-08-11 06:40:59,0,Unknown,"The name of the road is Vallholt, not Vallarholt",2,0,mfbehrens,
1863300,Ísland,64.5610959,-21.7613588,2019-07-30 00:00:00,2020-08-11 06:39:44,0,Kjarrval,Those roads do not connect here.,2,0,mfbehrens,
1108896,Ísland,64.5467326,-21.9115841,2017-08-18 00:00:00,2020-08-11 06:39:15,0,Kjarrval,The streets are connected.,2,0,mfbehrens,
1848101,Ísland,64.5381707,-21.9269136,2019-07-18 00:00:00,2020-08-11 06:39:00,0,fnxf,"'Private Strasse, kein Durchgang' POI name: Helgugata POI types: highway-service OSM data version: 2019-06-21T10:47:15Z  #mapsme",2,0,mfbehrens,
1848102,Ísland,64.5382287,-21.9273089,2019-07-18 00:00:00,2020-08-11 06:38:56,0,fnxf,"'weg existiert nicht' The place has gone or never existed. This is an auto-generated note from MAPS.ME application: a user reports a POI that is visible on a map (which can be outdated), but cannot be found on the ground. POI has no name POI types: wheelchair-no hwtag-nobicycle highway-path hwtag-yesfoot OSM data version: 2019-06-21T10:47:15Z  #mapsme",2,0,mfbehrens,
2284056,Ísland,64.5359800,-21.9224800,2020-07-28 00:00:00,2020-08-11 06:38:21,0,Unknown,"Dies ist kein Café mehr, sondern in diesem Gebäude befindet sich jetzt das 'Egils Guesthouse'",2,0,mfbehrens,
619596,Ísland,64.7737493,-22.3013331,2016-07-07 00:00:00,2020-08-11 06:37:13,0,crumbo,"Camping spot with showers, toilets and full kitchen. Free WiFi. Also has cabins and can accomdate large groups. More details on their website. (OSM data version: 2016-06-01T10:03:02Z) #mapsme",2,0,mfbehrens,
1868424,Ísland,64.8321026,-22.3158628,2019-08-03 00:00:00,2020-08-11 06:33:46,0,mfbehrens,connected to lake,2,0,mfbehrens,
1868425,Ísland,64.8411334,-22.3194517,2019-08-03 00:00:00,2020-08-11 06:32:09,0,mfbehrens,surface concrete,2,0,mfbehrens,
1868426,Ísland,64.8464724,-22.3785334,2019-08-03 00:00:00,2020-08-11 06:31:39,0,mfbehrens,parking,2,0,mfbehrens,
1870854,Ísland,64.8057889,-23.0760757,2019-08-05 00:00:00,2020-08-11 06:30:48,0,mfbehrens,asphalt up to here,2,0,mfbehrens,
1869692,Ísland,64.8057817,-23.0760979,2019-08-04 00:00:00,2020-08-11 06:30:46,0,mfbehrens,asphalt till here,2,0,mfbehrens,
1869697,Ísland,64.8288754,-23.4047374,2019-08-04 00:00:00,2020-08-11 06:30:13,0,mfbehrens,border is here,2,0,mfbehrens,
1869695,Ísland,64.8199279,-23.3787885,2019-08-04 00:00:00,2020-08-11 06:30:06,0,mfbehrens,beach till here,2,0,mfbehrens,
1869696,Ísland,64.8208506,-23.3820119,2019-08-04 00:00:00,2020-08-11 06:29:44,0,mfbehrens,Sand towards the sea  gravel to church,2,0,mfbehrens,
1869694,Ísland,64.8241630,-23.3863005,2019-08-04 00:00:00,2020-08-11 06:29:10,0,mfbehrens,"asphalt road lanes 2, 1 per direction no markings",2,0,mfbehrens,
1869693,Ísland,64.8315935,-23.4063365,2019-08-04 00:00:00,2020-08-11 06:28:36,0,mfbehrens,50km/h,2,0,mfbehrens,
1869698,Ísland,64.8340143,-23.4095852,2019-08-04 00:00:00,2020-08-11 06:26:33,0,mfbehrens,90kmh two lanes smooth asphalt not lit markings yes,2,0,mfbehrens,
1869699,Ísland,64.8185285,-23.5668938,2019-08-04 00:00:00,2020-08-11 06:23:31,0,mfbehrens,river in tunnel,2,0,mfbehrens,
91589,Ísland,64.8169310,-23.5867230,2013-12-27 00:00:00,2020-08-11 06:23:21,0,Unknown,"Moved from OSB ID599420:  Somewhere beetwen Búðir and Árnarstapi, we have the ravine rauðfeldsgjá and the river Sleggjubeina. See also http://is.wikipedia.org/wiki/Rau%C3%B0feldsgj%C3%A1 [HelmutNeukirchen, 2011-07-05 16:21:03 CEST]",2,0,mfbehrens,
