note_id,country_name,latitude,longitude,opened_at,closed_at,days_to_resolution,opened_by_username,opening_comment,total_comments,was_reopened,closed_by_username,closing_comment
704155,Ísland,64.1198326,-21.8495742,2016-09-07 00:00:00,2017-05-31 19:59:43,0,Kjarrval,Building missing.,2,0,Alan Trick,Added.
632484,Ísland,64.1913023,-21.6815729,2016-07-18 00:00:00,2017-05-31 19:56:05,0,Kjarrval,Road forks here.,2,0,Alan Trick,It's been recently added.
332198,Ísland,64.4090266,-21.6176176,2015-03-16 00:00:00,2017-05-31 19:54:41,0,shravan91,"Local survey needed, if geyser exists or not!",3,0,Alan Trick,"Haven't been around here, I'm pretty sure there's no geyser's here."
968493,Ísland,65.3119368,-20.9058237,2017-04-18 00:00:00,2017-05-31 19:51:37,0,Golafsson,This is a church with the name Melstaðarkirkja (Church Melstadur),2,0,Alan Trick,Added.
968487,Ísland,65.3118472,-20.9083128,2017-04-18 00:00:00,2017-05-31 19:51:33,0,Golafsson,This house ís named 'Melstaður',2,0,Alan Trick,Added.
968495,Ísland,65.3086384,-20.9323883,2017-04-18 00:00:00,2017-05-31 19:47:40,0,Golafsson,This farm goes under the name 'Svarðbæli' (Svardbaeli),2,0,Alan Trick,added
827898,Ísland,65.6787597,-18.1122160,2016-12-25 00:00:00,2017-05-31 19:43:05,0,Hafdís Jóna,heima (OSM data version: 2016-07-15T17:38:02Z) #mapsme,3,0,Alan Trick,I'm going to close this. It's probably just a maps.me user who doesn't realize what the notes feature does.
702946,Ísland,66.0243958,-16.5672731,2016-09-06 00:00:00,2017-05-31 19:39:44,0,Galgi,"The place has gone or never existed. This is an auto-generated note from MAPS.ME application: a user reports a POI that is visible on a map (which can be outdated), but cannot be found on the ground. (OSM data version: 2016-08-08T15:45:02Z) #mapsme",4,1,Alan Trick,Or maybe http://www.openstreetmap.org/note/441859
384202,Ísland,66.0268079,-16.5526199,2015-06-21 00:00:00,2017-05-31 19:38:46,0,Unknown,Road 862 to Dettifoss is currently closed.,4,0,Alan Trick,"Seasonal road closures are pretty normal in many places this far north (or south). As for now, I don't think we have a good way of mapping them either."
40101,Ísland,64.7512897,-14.0607834,2013-09-11 00:00:00,2017-05-31 18:53:34,0,Unknown,Stuttidalur,3,0,Alan Trick,
686901,Ísland,64.6487645,-14.5175168,2016-08-25 00:00:00,2017-05-31 18:51:18,0,trail-blazer,"The place has gone or never existed. This is an auto-generated note from MAPS.ME application: a user reports a POI that is visible on a map (which can be outdated), but cannot be found on the ground. User comments: 'driven there, no signs on the road, house now seems to be private property' (OSM data version: 2016-07-15T17:38:02Z) #mapsme",3,0,Alan Trick,
915753,Ísland,64.4204801,-14.5947361,2017-03-05 00:00:00,2017-05-31 18:48:53,0,Unknown,This part of the road is marked incorrectly. Look at public GPS marks,2,0,Alan Trick,"Fixed, as much as possible, none of the available imagery seems to be even remotely right."
91773,Ísland,63.9909680,-16.8948790,2013-12-27 00:00:00,2017-05-31 07:31:07,0,Unknown,"Moved from OSB ID645230:  road 9894 Freysnesvegur missing here. GPS traces needed! [HelmutNeukirchen, 2012-04-18 12:04:43 CEST]",2,0,Alan Trick,"I think this has been added correctly, the GPS traces are now here. I'm not exactly sure where it ends."
742157,Ísland,63.4411526,-20.2688837,2016-10-09 00:00:00,2017-05-31 03:23:05,0,Devin12,"The place has gone or never existed. This is an auto-generated note from MAPS.ME application: a user reports a POI that is visible on a map (which can be outdated), but cannot be found on the ground. User comments: 'this place is already added with the correct address' (OSM data version: 2016-09-19T14:38:03Z) #mapsme",2,0,Alan Trick,
632989,Ísland,63.4424382,-20.2721345,2016-07-18 00:00:00,2017-05-31 03:22:57,0,Stalfur,"The place has gone or never existed. This is an auto-generated note from MAPS.ME application: a user reports a POI that is visible on a map (which can be outdated), but cannot be found on the ground. User comments: 'farin' (OSM data version: 2016-06-20T05:57:02Z) #mapsme",4,0,Alan Trick,
913584,Ísland,64.2875637,-15.0644875,2017-03-03 00:00:00,2017-05-31 03:21:15,0,Unknown,This part of the road is marked incorrectly. Look at public GPS marks,3,0,Alan Trick,Fixed
194068,Ísland,64.2545603,-15.2078462,2014-07-04 00:00:00,2017-05-31 02:56:21,0,morray,it's a Walter park,6,0,Alan Trick,
194403,Ísland,64.1300837,-15.9883711,2014-07-05 00:00:00,2017-05-31 02:55:47,0,morray,lake is missing,2,0,Alan Trick,"I'm not exactly sure it's a lake, but I've added it."
961980,Ísland,64.0169057,-16.9660843,2017-04-13 00:00:00,2017-05-31 02:40:13,0,玉覃秋,瓦特纳徒步起点 (OSM data version: 2017-02-15T16:20:03Z) #mapsme,2,0,Alan Trick,
903458,Ísland,63.8530536,-17.8722507,2017-02-23 00:00:00,2017-05-31 02:38:09,0,Unknown,This part of the road looks a bit odd. It doesn't cover the aerial view.,2,0,Alan Trick,The bing imagery is poorly aligned here (as you can see based on GPS traces. Fixed using digitalglobe standard imagery
947582,Ísland,63.5280000,-19.4808000,2017-03-31 00:00:00,2017-05-31 02:24:21,0,Unknown,Kvernufoss Falls,2,0,Alan Trick,The falls are on the map: http://www.openstreetmap.org/node/452032633
91390,Ísland,63.6218390,-20.0303240,2013-12-27 00:00:00,2017-05-31 02:21:52,0,Unknown,"Moved from OSB ID699919:  What is this? Can't tell from aerial imagery, but looks like a memorial or something similar [olvagor, 2012-12-16 12:39:30 CET]",3,0,Alan Trick,I've made a few updates.
972893,Ísland,64.7477711,-23.8179961,2017-04-22 00:00:00,2017-05-31 02:00:01,0,thomasperre,3250 kronas for 45min guide tour (OSM data version: 2016-06-20T05:57:02Z) #mapsme,2,0,Alan Trick,"This is not data that OSM uses, I think."
576945,Ísland,64.8891234,-23.6874047,2016-05-29 00:00:00,2017-05-31 01:57:25,0,Jordi Vives,Toilets Hot water Shower Electricity BBQ Swimming pool Supermarket Restaurant Horses (OSM data version: 2016-05-10T14:41:03Z) #mapsme,2,0,Alan Trick,"Half of these feature are mostly amenities that are available in Olafsvik, the rest of them are mostly added alread"
834221,Ísland,64.9662243,-23.1269694,2016-12-29 00:00:00,2017-05-31 01:23:57,0,Amanda Pogue,according to google maps there is a place here that one could possibly pull off to see orcas. (OSM data version: 2016-12-14T16:41:03Z) #mapsme,2,0,Alan Trick,Looks like you added the viewpoint already. Closing note.
742136,Ísland,63.4411526,-20.2688837,2016-10-09 00:00:00,2017-05-31 01:09:58,0,Devin12,"The place has gone or never existed. This is an auto-generated note from MAPS.ME application: a user reports a POI that is visible on a map (which can be outdated), but cannot be found on the ground. User comments: 'this place is already added with the correct address' (OSM data version: 2016-09-19T14:38:03Z) #mapsme",2,0,Alan Trick,Fixed
1011616,Ísland,65.6395000,-16.8419000,2017-05-28 00:00:00,2017-05-29 15:17:56,0,tolekbanan,wfwefwfwfw,2,0,mavl,The note does not contain an useful information for OpenStreetMap.
467074,Ísland,64.0898324,-21.8611836,2015-11-12 00:00:00,2017-05-28 13:06:49,0,Stalfur,"Approximate from GPS, resurvey with newer imagery",2,0,Stalfur,
196600,Ísland,64.0950570,-21.8912698,2014-07-09 00:00:00,2017-05-28 13:05:22,0,Kjarrval,Houses being constructed in the area. More than the current imagery shows.,2,0,Stalfur,
1009136,Ísland,63.8846618,-20.2853605,2017-05-27 00:00:00,2017-05-27 19:33:17,0,Vladyslav Motorov,home (OSM data version: 2017-02-15T16:20:03Z) #mapsme,2,0,TheDutchMan13,
715818,Ísland,64.0738962,-20.8203472,2016-09-17 00:00:00,2017-05-27 18:57:07,0,Huei-Ru Breadiee Deng,Home (OSM data version: 2016-05-10T14:41:03Z) #mapsme,2,0,TheDutchMan13,
809831,Ísland,64.1016032,-21.8247312,2016-12-08 00:00:00,2017-05-26 10:19:05,0,Łukasz M,Polski sklep (OSM data version: 2016-11-23T15:14:03Z) #mapsme,2,0,Stalfur,
402118,Ísland,64.1164246,-21.8900335,2015-07-24 00:00:00,2017-05-26 10:18:21,0,Stalfur,Vantar húsin hér,2,0,Stalfur,Hús teiknuð
337461,Ísland,64.0046228,-22.5561118,2015-03-25 00:00:00,2017-05-18 09:53:31,0,Jarek 🚲,"This intersection is now a small roundabout, visible on e.g. http://en.ja.is/kort/?type=aerialnl&x=326091&y=393927&z=10",3,0,ualios,roundabout added
614863,Ísland,64.0423189,-21.9660238,2016-07-03 00:00:00,2017-05-06 09:47:20,0,Kjarrval,Missing building.,2,0,bergtor05,I have added the Hnoðravellir 41-45 buildings.
614868,Ísland,64.0421572,-21.9667820,2016-07-03 00:00:00,2017-05-06 09:46:35,0,Kjarrval,Missing building.,2,0,bergtor05,I have added the Hnoðravellir 52-58 buildings.
727649,Ísland,64.5383268,-21.9201949,2016-09-26 00:00:00,2017-05-04 20:08:09,0,Aida Suarez,bruartorg 4-310 Borgarnes (OSM data version: 2016-08-22T09:03:02Z) #mapsme,2,0,Mister Kanister,Brúartorg ist further north
693536,Ísland,64.2777913,-21.0924882,2016-08-30 00:00:00,2017-05-04 20:07:46,0,Wichian Pongtiyapaiboon,Pingviller bus stop (OSM data version: 2016-08-22T09:03:02Z) #mapsme,2,0,Mister Kanister,
618540,Ísland,64.3603060,-21.7778972,2016-07-06 00:00:00,2017-05-04 20:06:26,0,Bjarni Jarlsson,Skrifstofa Norðuráls á Grundartanga (OSM data version: 2016-06-20T05:57:02Z) #mapsme,2,0,Mister Kanister,
677108,Ísland,64.1261450,-21.9099444,2016-08-18 00:00:00,2017-05-04 19:52:23,0,Kjarrval,Kindergarten name: Sólborg,2,0,Mister Kanister,
843550,Ísland,64.1460802,-21.9279400,2017-01-06 00:00:00,2017-04-30 00:43:20,0,olede4,"The place has gone or never existed. This is an auto-generated note from MAPS.ME application: a user reports a POI that is visible on a map (which can be outdated), but cannot be found on the ground. User comments: 'destroyed, construction plant' (OSM data version: 2016-12-14T16:41:03Z) #mapsme",2,0,olede4,
580065,Ísland,64.1486498,-21.9316924,2016-06-02 00:00:00,2017-04-30 00:43:12,0,olede4,P2 (OSM data version: 2016-05-10T14:41:03Z) #mapsme,2,0,olede4,
962412,Ísland,64.1454000,-21.9195000,2017-04-13 00:00:00,2017-04-30 00:30:44,0,MagaliVdV,KEX HOSTEL,2,0,olede4,
685291,Ísland,64.1441912,-21.9297357,2016-08-23 00:00:00,2017-04-27 22:01:54,0,Tai Siu Pang,Fish & more Cafe (OSM data version: 2016-07-15T17:38:02Z) #mapsme,2,0,Mister Kanister,
672115,Ísland,65.6381842,-16.9099319,2016-08-15 00:00:00,2017-04-19 16:52:41,0,Samuel Colle Dominguez Maldonado,Jarobotdin (OSM data version: 2016-07-15T17:38:02Z) #mapsme,6,0,Mister Kanister,"As Jarðböðin has already been mapped, I will close this note."
727656,Ísland,65.4776821,-24.0702516,2016-09-26 00:00:00,2017-04-11 20:30:27,0,FrancisG77,"'Rauðisandur' beach or Red Sands beach is a beautiful red beach in a very remote area in the Westfjords of Iceland. Most beaches in Iceland are black, but the beaches in the Westfjords are golden or pink. (OSM data version: 2016-08-22T09:03:02Z) #mapsme",2,0,Mister Kanister,"Yes, Rauðisandur is already on the map."
674222,Ísland,65.7787178,-21.4983788,2016-08-16 00:00:00,2017-04-11 20:29:09,0,webph,Kleiner Parkplatz  (OSM data version: 2016-07-15T17:38:02Z) #mapsme,2,0,Mister Kanister,
660137,Ísland,65.7408359,-19.6364870,2016-08-06 00:00:00,2017-04-11 20:25:58,0,Kjarrval,Street name: Ártorg,2,0,Mister Kanister,
660140,Ísland,65.7429674,-19.6352794,2016-08-06 00:00:00,2017-04-11 20:25:05,0,Kjarrval,Street name: Víðimýri,2,0,Mister Kanister,
674473,Ísland,65.8989348,-19.4170865,2016-08-16 00:00:00,2017-04-11 20:16:36,0,Reisemobilist,Museum 'Icelandic Emigration Center' (OSM data version: 2016-07-15T17:38:02Z) #mapsme,2,0,Mister Kanister,
674560,Ísland,65.8991883,-19.4199190,2016-08-16 00:00:00,2017-04-11 20:16:33,0,Reisemobilist,"Museum, ebenfalls Teil des Icelandic Emigration Center (OSM data version: 2016-07-15T17:38:02Z) #mapsme",2,0,Mister Kanister,
633748,Ísland,66.0644149,-19.1555080,2016-07-19 00:00:00,2017-04-11 20:16:17,0,pierred,Memorial stones of the first viking settler (OSM data version: 2016-06-20T05:57:02Z) #mapsme,2,0,Mister Kanister,added description in English
607615,Ísland,66.1497181,-18.9068043,2016-06-28 00:00:00,2017-04-11 20:14:46,0,Hazy*,"The place has gone or never existed.  This is an auto-generated note from MAPS.ME application: a user reports a POI that is visible on a map (which can be outdated), but cannot be found on the ground. (OSM data version: 2016-06-01T10:03:02Z) #mapsme",2,0,Mister Kanister,
674718,Ísland,66.1495543,-18.9097199,2016-08-17 00:00:00,2017-04-11 20:14:18,0,Reisemobilist,Für den Wohnwagenstellplatz ist das Symbol für eine Bushaltestelle eingetragen. Es sollte ausgetauscht werden gegen das Zeltplatzsymbol. (OSM data version: 2016-07-15T17:38:02Z) #mapsme,2,0,Mister Kanister,"Nee, stimmt eigentlich so."
751134,Ísland,66.1263764,-18.9389353,2016-10-17 00:00:00,2017-04-11 20:13:12,0,Dani Montenk,Resting area (OSM data version: 2016-09-19T14:38:03Z) #mapsme,2,0,Mister Kanister,"Yes, it's on the map."
638715,Ísland,65.6401480,-16.8211186,2016-07-23 00:00:00,2017-04-11 20:11:13,0,skyple,Mud pools / steaming ground (OSM data version: 2016-06-20T05:57:02Z) #mapsme,2,0,Mister Kanister,
786388,Ísland,65.7114947,-16.7699018,2016-11-17 00:00:00,2017-04-11 20:10:08,0,Obsos,Wanderung 34 (OSM data version: 2016-07-15T17:38:02Z) #mapsme,2,0,Mister Kanister,
694874,Ísland,66.2671287,-15.6892119,2016-08-30 00:00:00,2017-04-11 20:09:07,0,Lilithar,Raudanes point (OSM data version: 2016-08-22T09:03:02Z) #mapsme,2,0,Mister Kanister,
613684,Ísland,65.2585095,-14.4078921,2016-07-03 00:00:00,2017-04-11 20:06:13,0,vencedor,56 bus stop (OSM data version: 2016-06-20T05:57:02Z) #mapsme,2,0,Mister Kanister,"Yes, it's on the map."
411534,Ísland,64.9326142,-14.0283797,2015-08-09 00:00:00,2017-04-11 20:05:21,0,Yclain,gas station,2,0,Mister Kanister,"Yes, it's on the map."
629860,Ísland,64.9201521,-16.3948315,2016-07-16 00:00:00,2017-04-11 20:04:00,0,Jordi Vives,Pyramid-shaped mountain (OSM data version: 2016-06-20T05:57:02Z) #mapsme,2,0,Mister Kanister,
672876,Ísland,65.0304387,-16.7468858,2016-08-15 00:00:00,2017-04-11 20:03:48,0,Samuel Colle Dominguez Maldonado,F910 f88 (OSM data version: 2016-07-15T17:38:02Z) #mapsme,2,0,Mister Kanister,
776046,Ísland,64.0886402,-19.8750303,2016-11-07 00:00:00,2017-04-11 20:03:13,0,Arnaud BOISMAIN-SABLAIROLES,Amenity doesn't exist! #mapsme,2,0,Mister Kanister,There is no node with an amenity-tag here
834496,Ísland,63.7902087,-18.0682948,2016-12-30 00:00:00,2017-04-11 19:58:02,0,九夜葵,修女湖 (OSM data version: 2016-12-14T16:41:03Z) #mapsme,2,0,Mister Kanister,
637561,Ísland,63.6110986,-19.4409728,2016-07-22 00:00:00,2017-04-11 19:55:59,0,Unknown,'Baldvinsskáli' not 'Baldvinskáli'. Photo w name: http://www.isafold.de/sprengisandur96/gifs/img211.jpg,2,0,Mister Kanister,
195635,Ísland,63.5325431,-18.8878147,2014-07-07 00:00:00,2017-04-11 19:53:41,0,morray,"bridge over the creek here, it then continues at least up to the waterfall right west to the path",3,0,Mister Kanister,
807393,Ísland,63.4757949,-19.3691152,2016-12-06 00:00:00,2017-04-11 19:52:45,0,lin marvin,飛機殘骸路口 (OSM data version: 2016-08-08T15:45:02Z) #mapsme,3,0,Mister Kanister,google translate says that this note indicates that this is the way to the plane wreck.
701658,Ísland,63.5490406,-19.4924378,2016-09-05 00:00:00,2017-04-11 19:51:39,0,Wichian Pongtiyapaiboon,Waterfall (OSM data version: 2016-08-22T09:03:02Z) #mapsme,2,0,Mister Kanister,
584542,Ísland,63.5321897,-19.5111355,2016-06-05 00:00:00,2017-04-11 19:51:19,0,Ivan Baikal,20 водопадов позади (OSM data version: 2016-05-10T14:41:03Z) #mapsme,3,0,Mister Kanister,
857962,Ísland,63.7244900,-20.0380500,2017-01-21 00:00:00,2017-04-11 19:49:28,0,JAE RAK HWANG,24인 숙소 (OSM data version: 2016-12-14T16:41:03Z) #mapsme,2,0,Mister Kanister,You have already added this information to the hotel node.
883232,Ísland,63.9376586,-21.0011094,2017-02-06 00:00:00,2017-04-11 19:40:53,0,Jón Smári Guðjónsson,Augastaður (OSM data version: 2017-01-19T15:17:02Z) #mapsme,2,0,Mister Kanister,
857959,Ísland,63.9379048,-21.0014755,2017-01-21 00:00:00,2017-04-11 19:39:49,0,JAE RAK HWANG,셀포스 마트 (OSM data version: 2016-12-14T16:41:03Z) #mapsme,2,0,Mister Kanister,"Yes, it's a mall."
730802,Ísland,63.8650721,-21.1548053,2016-09-29 00:00:00,2017-04-11 19:38:11,0,Stalfur,Kirkjuhúsið (OSM data version: 2016-08-22T09:03:02Z) #mapsme,2,0,Mister Kanister,
730791,Ísland,63.8650933,-21.1542420,2016-09-29 00:00:00,2017-04-11 19:37:57,0,Stalfur,eggjahúsið (OSM data version: 2016-08-22T09:03:02Z) #mapsme,2,0,Mister Kanister,
730807,Ísland,63.8645132,-21.1516430,2016-09-29 00:00:00,2017-04-11 19:37:44,0,Stalfur,Sjóminjasafnið (OSM data version: 2016-08-22T09:03:02Z) #mapsme,2,0,Mister Kanister,
752517,Ísland,64.0829761,-22.6936221,2016-10-18 00:00:00,2017-04-11 19:32:46,0,Beefy001,Gardur Lighthouse (OSM data version: 2016-09-19T14:38:03Z) #mapsme,2,0,Mister Kanister,"Yes, exactly. As seen on the map."
685302,Ísland,63.8807081,-22.4416769,2016-08-23 00:00:00,2017-04-11 19:29:33,0,Tai Siu Pang,Silica Hotel (OSM data version: 2016-07-15T17:38:02Z) #mapsme,2,0,Mister Kanister,
674501,Ísland,63.9184801,-22.0979813,2016-08-16 00:00:00,2017-04-11 19:26:50,0,Reisemobilist,"The place has gone or never existed. This is an auto-generated note from MAPS.ME application: a user reports a POI that is visible on a map (which can be outdated), but cannot be found on the ground. User comments: 'kein öff. Parkplatz, Privatgrundstück' (OSM data version: 2016-06-20T05:57:02Z) #mapsme",2,0,Mister Kanister,
725360,Ísland,66.1005824,-23.4049828,2016-09-25 00:00:00,2017-04-11 18:29:19,0,Aida Suarez,piscina muuuuuy romantica (OSM data version: 2016-08-22T09:03:02Z) #mapsme,2,0,Mister Kanister,great... But nothing to add here...
891937,Ísland,66.0722601,-23.1300187,2017-02-14 00:00:00,2017-04-11 18:28:48,0,Unknown,akureyri,2,0,Mister Kanister,no
749847,Ísland,65.5388069,-19.4702841,2016-10-16 00:00:00,2017-04-11 18:25:57,0,Dani Montenk,Oldest church maybe. Beautiful. (OSM data version: 2016-09-19T14:38:03Z) #mapsme,2,0,Mister Kanister,"Yes, but what do you want to say with this note?"
589408,Ísland,65.3974750,-20.9457526,2016-06-10 00:00:00,2017-04-11 18:25:31,0,Oddur Sigurðarson,Félagsheimilið Hvammstanga (OSM data version: 2016-06-01T10:03:02Z) #mapsme,2,0,Mister Kanister,þessi er þegar kominn á skrá
947409,Ísland,64.1470452,-21.9329356,2017-03-31 00:00:00,2017-04-11 18:23:13,0,rakepang,Pizza (OSM data version: 2016-07-15T17:38:02Z) #mapsme,2,0,Mister Kanister,
914804,Ísland,64.1468885,-21.9331220,2017-03-04 00:00:00,2017-04-11 18:23:07,0,Lara Maree,islenski barinn (OSM data version: 2017-01-19T15:17:02Z) #mapsme,2,0,Mister Kanister,already in...
720513,Ísland,64.1557344,-21.8646169,2016-09-21 00:00:00,2017-04-11 18:22:28,0,Unknown,Icewear,2,0,Mister Kanister,
624482,Ísland,64.1526289,-21.8612526,2016-07-11 00:00:00,2017-04-11 18:17:58,0,Kjarrval,Building missing (Korngarðar 1),2,0,Mister Kanister,komið á skrá
854222,Ísland,64.1306014,-21.8774018,2017-01-17 00:00:00,2017-04-11 18:15:20,0,njaard,second hand (OSM data version: 2016-12-14T16:41:03Z) #mapsme,2,0,Mister Kanister,this is already in the database
181438,Ísland,64.0858241,-21.9376230,2014-06-09 00:00:00,2017-04-11 18:04:42,0,Kjarrval,Buildings here. Currently not in imagery.,5,1,Mister Kanister,þessi eru komin
621733,Ísland,64.0738437,-21.9315868,2016-07-09 00:00:00,2017-04-11 17:59:26,0,Kjarrval,Playground.,2,0,Mister Kanister,þetta er komið
912351,Ísland,63.3983130,-19.1266864,2017-03-02 00:00:00,2017-04-04 09:27:54,0,martin_schilliger,"The place has gone or never existed. This is an auto-generated note from MAPS.ME application: a user reports a POI that is visible on a map (which can be outdated), but cannot be found on the ground. User comments: 'Weg gesperrt, Flora Schutz' (OSM data version: 2017-01-19T15:17:02Z) #mapsme",3,0,martin_schilliger,"Permanently, I removed it from OSM."
889013,Ísland,64.6410482,-17.5277385,2017-02-11 00:00:00,2017-04-02 17:22:58,0,Shu Lam,🌋 (OSM data version: 2017-01-19T15:17:02Z) #mapsme,2,0,Jarek 🚲,
897113,Ísland,64.9841822,-18.1059215,2017-02-18 00:00:00,2017-04-02 17:22:38,0,Livirathon,冰島 (OSM data version: 2017-01-19T15:17:02Z) #mapsme,2,0,Jarek 🚲,
727655,Ísland,65.4776821,-24.0702516,2016-09-26 00:00:00,2017-04-02 17:14:52,0,FrancisG77,"'Rauðisandur' beach or Red Sands beach is a beautiful red beach in a very remote area in the Westfjords of Iceland. Most beaches in Iceland are black, but the beaches in the Westfjords are golden or pink. (OSM data version: 2016-08-22T09:03:02Z) #mapsme",2,0,Jarek 🚲,mapped as http://www.openstreetmap.org/way/177059756
674474,Ísland,65.7363374,-23.2091615,2016-08-16 00:00:00,2017-04-02 17:09:05,0,Reisemobilist,"The place has gone or never existed.  This is an auto-generated note from MAPS.ME application: a user reports a POI that is visible on a map (which can be outdated), but cannot be found on the ground.  User comments: Der Platz ist nicht mehr als Zeltplatz ausgewiesen.   (OSM data version: 2016-06-01T10:03:02Z) #mapsme",2,0,Jarek 🚲,"There is no more camping node here, see comment in http://www.openstreetmap.org/note/637721"
637721,Ísland,65.7363374,-23.2091615,2016-07-22 00:00:00,2017-04-02 17:06:28,0,andrzej_aa,"The place has gone or never existed.  This is an auto-generated note from MAPS.ME application: a user reports a POI that is visible on a map (which can be outdated), but cannot be found on the ground.  User comments: This is not an official campsite, although many people think so. There are picnic benches and a toilet surrounded with a lot of short-cut grass so it might look as a camping.   (OSM data version: 2016-06-01T10:03:02Z) #mapsme",2,0,Jarek 🚲,"no camping node is located in the area, it might have already been deleted"
752501,Ísland,64.0829761,-22.6936221,2016-10-18 00:00:00,2017-04-02 17:04:14,0,Beefy001,Gardur Lighthouse (OSM data version: 2016-09-19T14:38:03Z) #mapsme,2,0,Jarek 🚲,http://www.openstreetmap.org/node/1502313284
327586,Ísland,63.8476182,-22.4288074,2015-03-07 00:00:00,2017-04-02 17:03:12,0,Unknown,Húsavík,2,0,Jarek 🚲,Húsavík is on the other side of the island
685293,Ísland,63.8807081,-22.4416769,2016-08-23 00:00:00,2017-04-02 17:02:28,0,Tai Siu Pang,Silica Hotel (OSM data version: 2016-07-15T17:38:02Z) #mapsme,2,0,Jarek 🚲,http://www.openstreetmap.org/way/249143720
804887,Ísland,64.3266100,-20.1216814,2016-12-04 00:00:00,2017-04-02 17:00:22,0,SebStar,"isl. gull = „gold“, foss = „waterfall“ (OSM data version: 2016-11-05T13:55:03Z) #mapsme",2,0,Jarek 🚲,
814810,Ísland,64.3273163,-20.1194376,2016-12-13 00:00:00,2017-04-02 17:00:15,0,SophieRasmussen,Vandfaldet Gullfoss,2,0,Jarek 🚲,
857954,Ísland,64.3094954,-20.3020479,2017-01-21 00:00:00,2017-04-02 16:57:59,0,JAE RAK HWANG,게이시르 (OSM data version: 2016-12-14T16:41:03Z) #mapsme,2,0,Jarek 🚲,
834498,Ísland,64.1749802,-20.6546605,2016-12-30 00:00:00,2017-04-02 16:57:23,0,九夜葵,奥尔塔湖 (OSM data version: 2016-12-14T16:41:03Z) #mapsme,3,0,Jarek 🚲,
632223,Ísland,64.2175474,-20.8839303,2016-07-18 00:00:00,2017-04-02 16:57:00,0,Marc Waeber,Tropfsteinhöhle (OSM data version: 2016-06-20T05:57:02Z) #mapsme,2,0,Jarek 🚲,
751315,Ísland,64.1878171,-21.1345586,2016-10-17 00:00:00,2017-04-02 16:56:41,0,温其东,国会湖 (OSM data version: 2016-09-19T14:38:03Z) #mapsme,3,0,Jarek 🚲,
750640,Ísland,64.8069870,-23.7919063,2016-10-17 00:00:00,2017-04-02 16:55:18,0,cachitochen,雪山 (OSM data version: 2016-08-22T09:03:02Z) #mapsme,2,0,Jarek 🚲,
590462,Ísland,64.8637295,-24.0390678,2016-06-11 00:00:00,2017-04-02 16:55:01,0,Heidi Orcino,Tall skinny orange lighthouse (OSM data version: 2016-06-01T10:03:02Z) #mapsme,2,0,Jarek 🚲,"mapped as http://www.openstreetmap.org/way/184505000 , marking note-to-self auto-imported from maps.me as resolved"
590463,Ísland,64.8812759,-23.9871711,2016-06-11 00:00:00,2017-04-02 16:54:21,0,Heidi Orcino,Orange sand black rock beach  (OSM data version: 2016-06-01T10:03:02Z) #mapsme,2,0,Jarek 🚲,http://www.openstreetmap.org/way/169282379 Skarðsvík beach mapped
790434,Ísland,64.9399460,-23.3074779,2016-11-21 00:00:00,2017-04-02 16:53:36,0,Edward Ng,Nice Mountain (OSM data version: 2016-11-05T13:55:03Z) #mapsme,3,0,Jarek 🚲,
441861,Ísland,65.6459030,-16.9108097,2015-09-26 00:00:00,2017-04-02 16:49:59,0,Traveller123,Private path from here. Threpassing explicitly denied.,3,0,Jarek 🚲,"http://www.openstreetmap.org/way/372648879 has access=private, marking as resolved"
715516,Ísland,65.6256622,-16.8833941,2016-09-17 00:00:00,2017-04-02 16:49:19,0,Hsianglan Chiu,藍色洞穴 (OSM data version: 2016-08-22T09:03:02Z) #mapsme,2,0,Jarek 🚲,mapped as http://www.openstreetmap.org/node/796482084
708023,Ísland,66.0433172,-17.3410407,2016-09-10 00:00:00,2017-04-02 16:48:11,0,Wichian Pongtiyapaiboon,Whale watching tour (OSM data version: 2016-08-22T09:03:02Z) #mapsme,2,0,Jarek 🚲,"mapped at their actual locations, http://www.openstreetmap.org/node/458242626 and http://www.openstreetmap.org/node/458242627"
681695,Ísland,65.8123335,-16.3996765,2016-08-21 00:00:00,2017-04-02 16:44:09,0,Pblmm,Parking for Dettifoss and Selfoss hiking trails (OSM data version: 2016-08-08T15:45:02Z) #mapsme,2,0,Jarek 🚲,marking note-to-self auto-imported from maps.me as resolved
725362,Ísland,66.5361793,-16.0261614,2016-09-25 00:00:00,2017-04-02 16:41:03,0,Aida Suarez,sitio mas al norte de islandia. toca el circulo polar artico (OSM data version: 2016-08-22T09:03:02Z) #mapsme,2,0,Jarek 🚲,
703958,Ísland,63.4390472,-20.2740134,2016-09-07 00:00:00,2017-04-02 16:39:30,0,Александра Михалёва,Пешая/велосипедная (OSM data version: 2016-07-15T17:38:02Z) #mapsme,2,0,Jarek 🚲,"comment says 'Walking / Biking', I take it to be a note-to-self, marking as resolved"
